dossier_number,decision_number,pronounced_date,firm_name,address,county,registration_code,registration_order,euid,registrator,requestor,quality,request_details,disposition_text
22107/28.06.2024,4422,02.07.2024,GRIGORIU DĂNUŢ-CRISTIAN ÎNTREPRINDERE INDIVIDUALĂ,"Municipiul Brăila, Strada ŞCOLILOR, Nr. 28, Bloc D2, Scara 4, Etaj 3, Ap. 59, Judet",Brăila,38186947,F9/423/2017,ROONRC.F9/423/2017,Cecilia Dorobăț,,,,"Admite cererea înregistrată sub nr. 22107 din data de 28.06.2024  având ca obiect:\nradiere firmă\nDispune publicarea prezentei încheieri în Buletinul Electronic al Registrului Comerţului.\nExecutorie.\nCu drept de plângere, în termen de 10 zile, la judecătoria în a cărei rază teritorială se află sediul\nprofesional al solicitantului, în condițiile art.112 și art.113 din Legea nr. 265/2022 privind registrul\ncomerțului și pentru modificarea și completarea altor acte normative cu incidență asupra înregistrării\nîn registrul comerțului.\nPronunțată în data de: 01.07.2024"
22112/28.06.2024,4424,02.07.2024,COMȘA CĂTĂLINA-IULIA PERSOANĂ FIZICĂ AUTORIZATĂ,"Municipiul Brăila, Strada FRANCEZĂ, Nr. 45, Bloc 20A, Scara 1, Etaj 1, Ap. 1, Judet",Brăila,43451047,F9/492/2020,ROONRC.F9/492/2020,Cecilia Dorobăț,COMȘA CĂTĂLINA-IULIA  în  calitate  de  persoana  fizica  autorizata   al  COMȘA  CĂTĂLINA-IULIA PERSOANĂ FIZICĂ AUTORIZATĂ,,radierea firmei din registrul comerțului.,"Admite cererea înregistrată sub nr. 22112 din data de 28.06.2024  având ca obiect:\nradiere firmă\nDispune publicarea prezentei încheieri în Buletinul Electronic al Registrului Comerţului.\nExecutorie.\nCu drept de plângere, în termen de 10 zile, la judecătoria în a cărei rază teritorială se află sediul\nprofesional al solicitantului, în condițiile art.112 și art.113 din Legea nr. 265/2022 privind registrul\ncomerțului și pentru modificarea și completarea altor acte normative cu incidență asupra înregistrării\nîn registrul comerțului.\nPronunțată în data de: 01.07.2024"
22135/28.06.2024,4432,01.07.2024,IDEALYNSHOP S.R.L.-D.,"Sat Ulmu, Comuna Ulmu, Strada CURCUBEULUI, Nr. 34, Judet Brăila",Brăila,38817177,J9/91/2018,ROONRC.J9/91/2018,Maria Cristina Covașă,BĂLĂBĂNEANU ALINA,administrator al  IDEALYNSHOP S.R.L.-D.,"înscriere  mențiuni , referitoare la  schimbare denumire firmă; domeniu principal de activitate/activitate principală;  cod obiect de activitate; Depunere act constitutiv actualizat (art.204 din Legea nr. 31/1990)  conform  actului Act constitutiv actualizat din data: 28.06.2024, modificare date asociaţi persoane fizice;  modificare date persoane împuternicite; modificare stare firmă; solicitant declaraţii şi înregistrarea  datelor din declarația pe propria răspundere cu privire la îndeplinirea condițiilor de   funcționarea/desfășurarea a activității","Admite cererea înregistrată sub nr. 22135 din data de 28.06.2024  având ca obiect: schimbare \ndenumire firmă; domeniu principal de activitate/activitate principală; cod obiect de activitate; Depunere \nact constitutiv actualizat (art.204 din Legea nr. 31/1990)  conform actului Act constitutiv actualizat din \ndata: 28.06.2024, modificare date asociaţi persoane fizice; modificare date persoane împuternicite; \nmodificare stare firmă; solicitant declaraţii, înregistrarea datelor din declarația pe propria răspundere cu \nprivire la îndeplinirea condițiilor de  funcționarea/desfășurarea a activității, potrivit datelor din: Decizie \nasociat unic nr. 1 din 28.06.2024; Declarație pe proprie răspundere cu privire la îndeplinirea condițiilor \nde funcționare/desfășurare a activității nr. 22135 din 28.06.2024; depunerea actului constitutiv actualizat \n. \nDispune publicarea prezentei încheieri în Buletinul Electronic al Registrului Comerţului.\n \nDispune publicarea în Monitorul Oficial al României, Partea a IV-a, a următoarelor acte: Decizie \nasociat unic nr. 1 din 28.06.2024 şi a notificării privind depunerea la oficiul registrului comerţului a \nactului constitutiv actualizat. \n \nExecutorie. \n \nCu drept de plângere, în termen de 10 zile, la Tribunalul Brăila în condițiile art.112 și art.113 din \nLegea nr. 265/2022 privind registrul comerțului și pentru modificarea și completarea altor acte \nnormative cu incidență asupra înregistrării în registrul comerțului. \n \nPronunțată în data de: 01.07.2024"
22133/28.06.2024,4431,01.07.2024,POPA DAN-CRISTIAN PERSOANĂ FIZICĂ AUTORIZATĂ,"Municipiul Brăila, Calea GALAŢI, Nr. 140, Judet Brăila",Brăila,48685820,F9/350/2023,ROONRC.F9/350/2023,Maria Cristina Covașă,POPA DAN- CRISTIAN,persoana fizica autorizata  al POPA DAN-CRISTIAN PERSOANĂ FIZICĂ  AUTORIZATĂ,radierea firmei din registrul comerțului.,"Admite cererea înregistrată sub nr. 22133 din data de 28.06.2024  având ca obiect: \nradiere firmă \nDispune publicarea prezentei încheieri în Buletinul Electronic al Registrului Comerţului. \n \nExecutorie. \n \nCu drept de plângere, în termen de 10 zile, la judecătoria în a cărei rază teritorială se află sediul \nprofesional al solicitantului, în condițiile art.112 și art.113 din Legea nr. 265/2022 privind registrul \ncomerțului și pentru modificarea și completarea altor acte normative cu incidență asupra înregistrării în \nregistrul comerțului. \n \nPronunțată în data de: 01.07.2024"
22179/01.07.2024,4460,02.07.2024,BACANIA LUI MATEI S.R.L.,"Sat Maxineni, Comuna Maxineni, Strada Aleea Primăverii, Nr. 23, Judet Brăila",Brăila,48997474,J9/761/2023,ROONRC.J9/761/2023,Cecilia Dorobăț,B.E.J.  EFTENE PETRUT,executor judecătoresc al  BACANIA LUI MATEI S.R.L.,"înscriere mențiuni referitoare la sechestru asigurător instituit asupra părților sociale, potrivit datelor din  Procesul-verbal (sechestru definitiv) încheiat la data de 15.04.2024, în Dosar executare nr.  735/EP/2023.","Admite cererea înregistrată sub nr. 22179 din data de 01.07.2024  având ca obiect: sechestru \nasigurător instituit asupra părților sociale, potrivit datelor din: Procesul-verbal (sechestru definitiv) \nîncheiat la data de 15.04.2024, în Dosar executare nr. 735/EP/2023. \nDispune publicarea prezentei încheieri în Buletinul Electronic al Registrului Comerţului.  \n \nExecutorie. \n \nCu drept de plângere, în termen de 10 zile, la Tribunalul Brăila în condițiile art.112 și art.113 \ndin Legea nr. 265/2022 privind registrul comerțului și pentru modificarea și completarea altor acte \nnormative cu incidență asupra înregistrării în registrul comerțului. \n \nPronunțată în data de: 02.07.2024"
22282/01.07.2024,4468,02.07.2024,PUNTO PROD SRL,"Municipiul Brăila, Bulevardul DOROBANŢILOR, Nr. 70, CAM.1, Bloc B25, Scara 4,",Brăila,6674150,J9/1730/1994,ROONRC.J09/1730/1994,Adriana-Florentina Mihăilescu,MOCANU  NICUSOR BEBI,administrator al  PUNTO PROD SRL,"înscriere mențiuni ,  referitoare la  solicitant declaraţii şi înregistrarea datelor din declarația pe propria răspundere cu privire  la îndeplinirea condițiilor de  funcționarea/desfășurarea a activității","Admite cererea înregistrată sub nr. 22282 din data de 01.07.2024  având ca obiect: solicitant \ndeclaraţii, înregistrarea datelor din declarația pe propria răspundere cu privire la îndeplinirea condițiilor \nde  funcționarea/desfășurarea a activității, potrivit datelor din: Declarație pe proprie răspundere cu \nprivire la îndeplinirea condițiilor de funcționare/desfășurare a activității nr. 22282 din 01.07.2024 . \nDispune publicarea prezentei încheieri în Buletinul Electronic al Registrului Comerţului.  \n \nExecutorie. \n \nCu drept de plângere, în termen de 10 zile, la Tribunalul Brăila în condițiile art.112 și art.113 din \nLegea nr. 265/2022 privind registrul comerțului și pentru modificarea și completarea altor acte \nnormative cu incidență asupra înregistrării în registrul comerțului. \n \nPronunțată în data de: 02.07.2024"
22233/01.07.2024,4466,02.07.2024,MILEA CRISTIANA ÎNTREPRINDERE INDIVIDUALĂ,"Municipiul Brăila, Bulevardul DOROBANŢILOR, Nr. 9, Bloc A9, Scara 2, Etaj 3, Ap.",Brăila,43815083,F9/82/2021,ROONRC.F9/82/2021,Maria Cristina Covașă,MILEA  CRISTIANA,titular întreprindere individuala  al MILEA CRISTIANA ÎNTREPRINDERE  INDIVIDUALĂ,radierea firmei din registrul comerțului.,"Admite cererea înregistrată sub nr. 22233 din data de 01.07.2024  având ca obiect: \nradiere firmă \nDispune publicarea prezentei încheieri în Buletinul Electronic al Registrului Comerţului. \n \nExecutorie. \n \nCu drept de plângere, în termen de 10 zile, la judecătoria în a cărei rază teritorială se află sediul \nprofesional al solicitantului, în condițiile art.112 și art.113 din Legea nr. 265/2022 privind registrul \ncomerțului și pentru modificarea și completarea altor acte normative cu incidență asupra înregistrării în \nregistrul comerțului. \n \nPronunțată în data de: 02.07.2024"
22189/01.07.2024,4483,03.07.2024,PÂCLEANU LUMINIŢA ÎNTREPRINDERE INDIVIDUALĂ,"Municipiul Brăila, Strada TÂRGOVIŞTE, Nr. 3, Bloc E2, Scara 7, Etaj 4, Ap. 139, Judet",Brăila,35619000,F9/43/2016,ROONRC.F9/43/2016,Cecilia Dorobăț,,,,"Admite cererea înregistrată sub nr. 22189 din data de 01.07.2024  având ca obiect: sedii\nsecundare, potrivit datelor din: Act adiţional nr. 1 din 09.02.2024 la contract de închiriere  nr. 3 din\n10.02.2023.\nDispune publicarea prezentei încheieri în Buletinul Electronic al Registrului Comerţului.\nExecutorie.\nCu drept de plângere, în termen de 10 zile, judecătoria în a cărei rază teritorială se află sediul\nprofesional al solicitantului, în condițiile art.112 și art.113 din Legea nr. 265/2022 privind registrul\ncomerțului și pentru modificarea și completarea altor acte normative cu incidență asupra înregistrării\nîn registrul comerțului.\nPronunțată în data de: 02.07.2024"
22092/28.06.2024,4393,02.07.2024,MEGALAND SRL,"Sat Vărsătura, Comuna Chiscani, PARCELA 8, LOT 93, CAMERA 1, Judet Brăila",Brăila,20817883,J9/71/2007,ROONRC.J09/71/2007,Cecilia Dorobăț,C.I.I. SANDOR OTILIA-MIHAELA prin SANDOR OTILIA-MIHAELA,"lichidator, pentru MEGALAND SRL","înscriere mențiuni , referitoare la  Depunere situaţii financiare finale ale societăţii lichidate  conform actului Raport privind situaţia economică a societăţii  avand numarul 453 din data: 27.06.2024","Admite cererea înregistrată sub nr. 22092 din data de 28.06.2024  având ca obiect: Depunere\nsituaţii financiare finale ale societăţii lichidate  conform actului Raport privind situaţia economică a\nsocietăţii  avand numarul 453 din data: 27.06.2024, potrivit datelor din: Raport privind situaţia\neconomică a societăţii nr. 453 din 27.06.2024 .\nDispune publicarea prezentei încheieri precum şi a situaţiei financiare finale de lichidare în\nBuletinul Electronic al Registrului Comerţului.\nExecutorie.\nCu drept de plângere, în termen de 10 zile, la Tribunalul Brăila în condițiile art.112 și art.113\ndin Legea nr. 265/2022 privind registrul comerțului și pentru modificarea și completarea altor acte\nnormative cu incidență asupra înregistrării în registrul comerțului.\nPronunțată în data de: 01.07.2024"
17440/21.06.2024,4406,01.07.2024,PLOIANU D. GHEORGHE ÎNTREPRINDERE INDIVIDUALĂ,"Municipiul Brăila, Str. TRANSILVANIEI, Nr. 42A, Judet Brăila",Brăila,26110910,F9/942/2009,ROONRC.F09/942/2009,Maria Cristina Covașă,PLOIANU  D. GHEORGHE,titular întreprindere individuala  al PLOIANU D. GHEORGHE  ÎNTREPRINDERE INDIVIDUALĂ,radierea firmei din registrul comerțului.,"Admite cererea înregistrată sub nr. 17440 din data de 21.06.2024  având ca obiect: \nradiere firmă \nDispune publicarea prezentei încheieri în Buletinul Electronic al Registrului Comerţului. \n \nExecutorie. \n \nCu drept de plângere, în termen de 10 zile, la judecătoria în a cărei rază teritorială se află sediul \nprofesional al solicitantului, în condițiile art.112 și art.113 din Legea nr. 265/2022 privind registrul \ncomerțului și pentru modificarea și completarea altor acte normative cu incidență asupra înregistrării în \nregistrul comerțului. \n \nPronunțată în data de: 01.07.2024"
22256,4440,02.07.2024,CHIVU COSMIN PERSOANĂ FIZICĂ AUTORIZATĂ,"Sat Tichileşti, Comuna Tichileşti, Strada MIHAIL SADOVEANU, Nr. 63, Judet Brăila",Brăila,50306945,F9/161/2024,ROONRC.F9/161/2024,Adriana-Florentina Mihăilescu,,,,"Admite cererea înregistrată sub numărul 22256 din data de 01.07.2024, autorizează constituirea \na CHIVU COSMIN PERSOANĂ FIZICĂ AUTORIZATĂ, cu următoarele date: \n \n - sediul profesional: Sat Tichilești, Comuna Tichilești, Strada MIHAIL SADOVEANU, Nr. 63, Judet \nBrăila \n - domeniul principal de activitate: grupa CAEN: \n960 - Alte activități de servicii \n - activitate principală: \n9602 - Coafură și alte activități de înfrumusețare \n             Persoana fizică autorizată:  \n1. CHIVU COSMIN, cu domiciliu în Judet Brăila, Sat Tichilești, Comuna Tichilești. \nDispune înregistrarea în registrul comerțului a datelor din declarația pe propria răspundere cu \nprivire la îndeplinirea condițiilor de  funcționarea/desfășurarea a activității. \nDispune publicarea prezentei încheieri în Buletinul Electronic al Registrului Comerțului. \nExecutorie \nCu drept de plângere, în termen de 10 zile, la judecătoria în a cărei rază teritorială se află sediul \nprofesional al solicitantului, în condițiile art. 112 și art. 113 din Legea nr. 265/2022 privind registrul \ncomerțului și pentru modificarea și completarea altor acte normative cu incidență asupra înregistrării în \nregistrul comerțului. \nPronunţată în data de: 02.07.2024"
22238/01.07.2024,4490,02.07.2024,MONOLIT SRL,"Municipiul Brăila, Calea GALAŢI, Nr. 291, Judet Brăila",Brăila,2264920,J9/326/1991,ROONRC.J09/326/1991,Maria Cristina Covașă,POPA  VALENTIN,administrator al  MONOLIT SRL,"înscriere mențiuni , referitoare la   transmitere părţi sociale pentru persoane fizice; Depunere act constitutiv actualizat (art.204 din Legea  nr. 31/1990)  conform actului Act constitutiv actualizat din data: 28.06.2024, retragere, modificare date  asociaţi persoane fizice","Admite cererea înregistrată sub nr. 22238 din data de 01.07.2024  având ca obiect: transmitere \npărţi sociale pentru persoane fizice; Depunere act constitutiv actualizat (art.204 din Legea nr. 31/1990)  \nconform actului Act constitutiv actualizat din data: 28.06.2024, retragere, modificare date asociaţi \npersoane fizice, potrivit datelor din: Hotărârea adunării generale a asociaţilor nr. 2 din 28.06.2024; \ndepunerea actului constitutiv actualizat . \nDispune publicarea prezentei încheieri în Buletinul Electronic al Registrului Comerţului.\n \nDispune publicarea în Monitorul Oficial al României, Partea a IV-a, a următoarelor acte: \nHotărârea adunării generale a asociaţilor nr. 2 din 28.06.2024 şi a notificării privind depunerea la oficiul \nregistrului comerţului a actului constitutiv actualizat. \n \nExecutorie. \n \nCu drept de plângere, în termen de 10 zile, la Tribunalul Brăila în condițiile art.112 și art.113 din \nLegea nr. 265/2022 privind registrul comerțului și pentru modificarea și completarea altor acte \nnormative cu incidență asupra înregistrării în registrul comerțului. \n \nPronunțată în data de: 02.07.2024"
22241/01.07.2024,4493,02.07.2024,CRISTINELY IMPEX SRL,"Municipiul Brăila, Strada SIMION BĂRNUŢIU, Nr. 5, Bloc A25, Scara 3, Ap. 54, Judet",Brăila,21280027,J9/221/2007,ROONRC.J09/221/2007,Maria Cristina Covașă,ROSIORU  NELA,administrator al  CRISTINELY IMPEX SRL,"înscriere mențiuni , referitoare  la  Depunere act constitutiv actualizat (art.204 din Legea nr. 31/1990)  conform actului Act constitutiv  actualizat din data: 19.06.2024, modificare date asociaţi persoane fizice; modificare date persoane  împuternicite","Admite cererea înregistrată sub nr. 22241 din data de 01.07.2024  având ca obiect: Depunere act \nconstitutiv actualizat (art.204 din Legea nr. 31/1990)  conform actului Act constitutiv actualizat din data: \n19.06.2024, modificare date asociaţi persoane fizice; modificare date persoane împuternicite, potrivit \ndatelor din: Hotărârea adunării generale a asociaţilor nr. 1 din 19.06.2024; depunerea actului constitutiv \nactualizat . \nDispune publicarea prezentei încheieri în Buletinul Electronic al Registrului Comerţului.\n \nDispune publicarea în Monitorul Oficial al României, Partea a IV-a, a următoarelor acte: \nHotărârea adunării generale a asociaţilor nr. 1 din 19.06.2024 şi a notificării privind depunerea la oficiul \nregistrului comerţului a actului constitutiv actualizat. \n \nExecutorie. \n \nCu drept de plângere, în termen de 10 zile, la Tribunalul Brăila în condițiile art.112 și art.113 din \nLegea nr. 265/2022 privind registrul comerțului și pentru modificarea și completarea altor acte \nnormative cu incidență asupra înregistrării în registrul comerțului. \n \nPronunțată în data de: 02.07.2024"
21989,4442,03.07.2024,MARYCAR GRILL S.R.L.,"Municipiul Brăila, Strada PROF. GHEORGHE MUNTEANU MURGOCI, Nr. 1F,",Brăila,50306929,J9/427/2024,,Cecilia Dorobăț,,,,"Admite cererea înregistrată sub numărul 21989 din data de 27.06.2024, autorizează constituirea\na MARYCAR GRILL S.R.L., cu următoarele date:\n - sediul social: Municipiul Brăila, Strada PROF. GHEORGHE MUNTEANU MURGOCI, Nr. 1F, \nJudet Brăila\n - domeniul principal de activitate: grupa CAEN:\n479 - Comerț cu amănuntul care nu se efectuează prin magazine, standuri, chioșcuri și piețe\n - activitate principală:\n4799 - Comerț cu amănuntul efectuat în afara  magazinelor, standurilor, chioșcurilor și piețelor\n - capital social:100 LEI, total părți sociale: 100 a câte 1 LEI fiecare\n - fondatori:\n1. CARAGAȚĂ MARIA, cu domiciliu în Judet Brăila, Municipiul Brăila.\n - administrator:\n1. CARAGAȚĂ MARIA, cu domiciliu în Judet Brăila, Municipiul Brăila.\n - durata de funcționare: nedeterminată; \nDispune înregistrarea în registrul comerțului a datelor din declarația pe propria răspundere cu\nprivire la îndeplinirea condițiilor de  funcționarea/desfășurarea a activității.\nDispune publicarea în Monitorul Oficial al României, Partea a IV-a, a extrasului prezentei\nîncheieri.\nDispune publicarea prezentei încheieri în Buletinul Electronic al Registrului Comerțului.\nExecutorie\nCu drept de plângere, în termen de 10 zile, la Tribunalul Brăila în condițiile art. 112 și art. 113\ndin Legea nr. 265/2022 privind registrul comerțului și pentru modificarea și completarea altor acte\nnormative cu incidență asupra înregistrării în registrul comerțului.\n1\n18\nPronunţată în data de: 02.07.2024"
22187/01.07.2024,4470,03.07.2024,FINOSTEO S.R.L.,"Municipiul Brăila, Calea CĂLĂRAŞILOR, Nr. 315, Bloc B2, Etaj PARTER, Judet",Brăila,44790793,J9/721/2021,ROONRC.J9/721/2021,Cecilia Dorobăț,,,,"Admite cererea înregistrată sub nr. 22187 din data de 01.07.2024  având ca obiect: radiere\nfirmă  Motivul radierii este art.235 din Legea nr.31 din 1990.\nDispune publicarea prezentei încheieri în Buletinul Electronic al Registrului Comerţului.\nExecutorie.\nCu drept de plângere, în termen de 10 zile, la Tribunalul Brăila în condițiile art.112 și art.113\ndin Legea nr. 265/2022 privind registrul comerțului și pentru modificarea și completarea altor acte\nnormative cu incidență asupra înregistrării în registrul comerțului.\nPronunțată în data de: 02.07.2024"
22231,4465,02.07.2024,MARPET CONSTRUCT S.R.L.,"Municipiul Brăila, Strada Nicolae Titulescu, Nr. 51BIS, Judet Brăila",Brăila,50309232,J9/430/2024,,Maria Cristina Covașă,,,,"Admite cererea înregistrată sub numărul 22231 din data de 01.07.2024, autorizează constituirea \na MARPET CONSTRUCT S.R.L., cu următoarele date: \n \n - sediul social: Municipiul Brăila, Strada Nicolae Titulescu, Nr. 51BIS, Judet Brăila \n - domeniul principal de activitate: grupa CAEN: \n222 - Fabricarea articolelor din material plastic \n - activitate principală: \n2223 - Fabricarea articolelor din material plastic pentru construcții \n - capital social:100 LEI, total părți sociale: 100 a câte 1 LEI fiecare \n - fondatori: \n1. MARIN PETRUȘ, cu domiciliu în Judet Brăila, Municipiul Brăila. \n - administrator: \n1. MARIN PETRUȘ, cu domiciliu în Judet Brăila, Municipiul Brăila. \n - durata de funcționare: nedeterminată;  \n \nDispune înregistrarea în registrul comerțului a datelor din declarația pe propria răspundere cu \nprivire la îndeplinirea condițiilor de  funcționarea/desfășurarea a activității. \nDispune publicarea în Monitorul Oficial al României, Partea a IV-a, a extrasului prezentei \nîncheieri. \nDispune publicarea prezentei încheieri în Buletinul Electronic al Registrului Comerțului. \nExecutorie \nCu drept de plângere, în termen de 10 zile, la Tribunalul Brăila în condițiile art. 112 și art. 113 \ndin Legea nr. 265/2022 privind registrul comerțului și pentru modificarea și completarea altor acte \nnormative cu incidență asupra înregistrării în registrul comerțului. \nPronunţată în data de: 02.07.2024 \n \n21\n2"
17392,4441,03.07.2024,DAC FACTORY TRANS S.R.L.,"Municipiul Brăila, Strada HIPODROM, Nr. 25, Cartier Obor, Bloc K1, Scara 1, Etaj 3,",Brăila,50306910,J9/426/2024,,Cecilia Dorobăț,,,,"Admite cererea înregistrată sub numărul 17392 din data de 21.06.2024, autorizează constituirea\na DAC FACTORY TRANS S.R.L., cu următoarele date:\n - sediul social: Municipiul Brăila, Strada HIPODROM, Nr. 25, Cartier Obor, Bloc K1, Scara 1, Etaj 3,\nAp. 14, Judet Brăila\n - domeniul principal de activitate: grupa CAEN:\n494 - Transporturi rutiere de mărfuri și servicii de mutare\n - activitate principală:\n4941 - Transporturi rutiere de mărfuri\n - capital social:200 LEI, total părți sociale: 20 a câte 10 LEI fiecare\n - fondatori:\n1. CONSTANDACHE DANIEL, cu domiciliu în Judet Brăila, Municipiul Brăila.\n2. BOGDAN CORNELIA, cu domiciliu în Judet Brăila, Municipiul Brăila.\n - administrator:\n1. BOGDAN CORNELIA, cu domiciliu în Judet Brăila, Municipiul Brăila.\n - durata de funcționare: nedeterminată; \nDispune înregistrarea în registrul comerțului a datelor din declarația pe propria răspundere cu\nprivire la îndeplinirea condițiilor de  funcționarea/desfășurarea a activității.\nDispune publicarea în Monitorul Oficial al României, Partea a IV-a, a extrasului prezentei\nîncheieri.\nDispune publicarea prezentei încheieri în Buletinul Electronic al Registrului Comerțului.\nExecutorie\n1\n24\nCu drept de plângere, în termen de 10 zile, la Tribunalul Brăila în condițiile art. 112 și art. 113\ndin Legea nr. 265/2022 privind registrul comerțului și pentru modificarea și completarea altor acte\nnormative cu incidență asupra înregistrării în registrul comerțului.\nPronunţată în data de: 02.07.2024"
22246/01.07.2024,4497,02.07.2024,PANALB SRL,"Municipiul Brăila, Str. GRIVIŢEI, Nr. 170, Judet Brăila",Brăila,23574673,J9/296/2008,ROONRC.J09/296/2008,Maria Cristina Covașă,ALBU   COSTICĂ,administrator al  PANALB SRL,radierea firmei din registrul comerțului,"Admite cererea înregistrată sub nr. 22246 din data de 01.07.2024  având ca obiect: radiere firmă  \nMotivul radierii este art.235 din Legea nr.31 din 1990. \nDispune publicarea prezentei încheieri în Buletinul Electronic al Registrului Comerţului.  \n \nExecutorie. \n \nCu drept de plângere, în termen de 10 zile, la Tribunalul Brăila în condițiile art.112 și art.113 din \nLegea nr. 265/2022 privind registrul comerțului și pentru modificarea și completarea altor acte \nnormative cu incidență asupra înregistrării în registrul comerțului. \n \nPronunțată în data de: 02.07.2024"
22244/01.07.2024,4495,02.07.2024,B-MENTOR S.R.L.,"Municipiul Brăila, Calea CĂLĂRAŞILOR, Nr. 57, mezanin , Bloc 4bis, Judet Brăila",Brăila,47584259,J9/89/2023,ROONRC.J9/89/2023,Maria Cristina Covașă,GABOR   BIANCA-MARIA,administrator al  B-MENTOR S.R.L.,"înscriere mențiuni ,  referitoare la  Depunere act constitutiv actualizat (art.204 din Legea nr. 31/1990)  conform actului Act  constitutiv actualizat din data: 28.06.2024, modificare date asociaţi persoane fizice; modificare date  persoane împuternicite; modificare stare firmă; Dizolvare conform art.235 din Legea nr. 31/1990","Admite cererea înregistrată sub nr. 22244 din data de 01.07.2024  având ca obiect: Depunere act \nconstitutiv actualizat (art.204 din Legea nr. 31/1990)  conform actului Act constitutiv actualizat din data: \n28.06.2024, modificare date asociaţi persoane fizice; modificare date persoane împuternicite; modificare \nstare firmă; Dizolvare conform art.235 din Legea nr. 31/1990, potrivit datelor din: Decizie asociat unic \nnr. 2 din 28.06.2024; depunerea actului constitutiv actualizat . \nDispune publicarea prezentei încheieri în Buletinul Electronic al Registrului Comerţului.\n \nDispune publicarea în Monitorul Oficial al României, Partea a IV-a, a următoarelor acte: Decizie \nasociat unic nr. 2 din 28.06.2024 şi a notificării privind depunerea la oficiul registrului comerţului a \nactului constitutiv actualizat. \n \nExecutorie. \n \nCu drept de plângere, în termen de 10 zile, la Tribunalul Brăila în condițiile art.112 și art.113 din \nLegea nr. 265/2022 privind registrul comerțului și pentru modificarea și completarea altor acte \nnormative cu incidență asupra înregistrării în registrul comerțului. \n \nPronunțată în data de: 02.07.2024"
