dossier_number,decision_number,pronounced_date,firm_name,address,county,registration_code,registration_order,euid,registrator,requestor,quality,request_details,disposition_text
22230,4464,02.07.2024,ALD IMPEX S.R.L.,"Sat Chiscani, Comuna Chiscani, Strada MIHAI EMINESCU, Nr. 28, Judet Brăila",Brăila,50309240,J9/429/2024,,Maria Cristina Covașă,,,,"Admite cererea înregistrată sub numărul 22230 din data de 01.07.2024, autorizează constituirea \na ALD IMPEX S.R.L., cu următoarele date: \n \n - sediul social: Sat Chiscani, Comuna Chiscani, Strada MIHAI EMINESCU, Nr. 28, Judet Brăila \n - domeniul principal de activitate: grupa CAEN: \n452 - Întreținerea și repararea autovehiculelor \n - activitate principală: \n4520 - Întreținerea și repararea autovehiculelor \n - capital social:100 LEI, total părți sociale: 100 a câte 1 LEI fiecare \n - fondatori: \n1. TUROSU DORINEL , cu domiciliu în Judet Brăila, Municipiul Brăila. \n2. POPA LUCIAN, cu domiciliu în Judet Galați, Municipiul Galați. \n3. LIPAN ADRIAN , cu domiciliu în Judet Brăila, Sat Chiscani, Comuna Chiscani. \n - administrator: \n1. LIPAN ADRIAN , cu domiciliu în Judet Brăila, Sat Chiscani, Comuna Chiscani. \n2. POPA LUCIAN, cu domiciliu în Judet Galați, Municipiul Galați. \n3. TUROSU DORINEL , cu domiciliu în Judet Brăila, Municipiul Brăila. \n - durata de funcționare: nedeterminată;  \n \nDispune înregistrarea în registrul comerțului a datelor din declarația pe propria răspundere cu \nprivire la îndeplinirea condițiilor de  funcționarea/desfășurarea a activității. \nDispune publicarea în Monitorul Oficial al României, Partea a IV-a, a extrasului prezentei \nîncheieri. \nDispune publicarea prezentei încheieri în Buletinul Electronic al Registrului Comerțului. \nExecutorie \n38\n2 \n \nCu drept de plângere, în termen de 10 zile, la Tribunalul Brăila în condițiile art. 112 și art. 113 \ndin Legea nr. 265/2022 privind registrul comerțului și pentru modificarea și completarea altor acte \nnormative cu incidență asupra înregistrării în registrul comerțului. \nPronunţată în data de: 02.07.2024"
22239/01.07.2024,4491,02.07.2024,CAMTER ONLY OFFICE S.R.L.,"Municipiul Brăila, Calea GALAŢI, Nr. 56, Bloc 1, Scara 1, Etaj 2, Ap. 10, Judet Brăila",Brăila,39111438,J9/223/2018,ROONRC.J9/223/2018,Maria Cristina Covașă,TEODORU  MARINEL,administrator al  CAMTER ONLY OFFICE S.R.L.,"înscriere mențiuni  , referitoare la  sedii secundare; Dizolvare si lichidare conform art.227 alin.(1), lit.d si art.235 din Legea  nr. 31/1990","Admite cererea înregistrată sub nr. 22239 din data de 01.07.2024  având ca obiect: sedii \nsecundare; Dizolvare si lichidare conform art.227 alin.(1), lit.d si art.235 din Legea nr. 31/1990, potrivit \ndatelor din: Decizie asociat unic nr. 1 din 28.06.2024 . \nDispune publicarea prezentei încheieri în Buletinul Electronic al Registrului Comerţului.\n \nDispune publicarea în Monitorul Oficial al României, Partea a IV-a, a următoarelor acte: Decizie \nasociat unic nr. 1 din 28.06.2024. \n \nExecutorie. \n \nCu drept de plângere, în termen de 10 zile, la Tribunalul Brăila în condițiile art.112 și art.113 din \nLegea nr. 265/2022 privind registrul comerțului și pentru modificarea și completarea altor acte \nnormative cu incidență asupra înregistrării în registrul comerțului. \n \nPronunțată în data de: 02.07.2024"
21956/27.06.2024,4486,03.07.2024,MIRETOLLI LINE SRL,"Municipiul Brăila, Şoseaua RÂMNICU SĂRAT, Nr. 109, Parcela 1, Constructia C6,",Brăila,36083490,J9/309/2016,ROONRC.J9/309/2016,Cecilia Dorobăț,,,,"Admite cererea înregistrată sub nr. 21956 din data de 27.06.2024  având ca obiect: prelungire\nvalabilitate acte sediu social, potrivit datelor din: Hotărârea adunării generale a asociaţilor nr. 1 din\n03.05.2024; Act adiţional nr. 4 din 03.05.2024 la contractul de închiriere  .\nDispune publicarea prezentei încheieri în Buletinul Electronic al Registrului Comerţului.\nExecutorie.\nCu drept de plângere, în termen de 10 zile, la Tribunalul Brăila în condițiile art.112 și art.113\ndin Legea nr. 265/2022 privind registrul comerțului și pentru modificarea și completarea altor acte\nnormative cu incidență asupra înregistrării în registrul comerțului.\nPronunțată în data de: 02.07.2024"
22297/01.07.2024,4480,03.07.2024,MRHAF COMPANY SRL,"Sat Gulianca, Comuna Salcia Tudor, Strada BRĂILEI, Nr. 1A, Judet Brăila",Brăila,36569849,J9/532/2016,ROONRC.J9/532/2016,Cecilia Dorobăț,"CII IACOB MIHAI-BOGDAN  prin  IACOB  MIHAI-BOGDAN  în  calitate  de  lichidator,  pentru   MRHAF COMPANY SRL",,"înscriere mențiuni , referitoare la  Raport privind situaţia economică a societăţii   conform  actului  Raport  privind  situaţia  economică  a  societăţii  din  data:  27.06.2024, Depunere situaţii financiare finale ale societăţii lichidate  conform actului Situaţie financiară finală de lichidare din data: 27.06.2024, modificare date persoane împuternicite","Admite cererea înregistrată sub nr. 22297 din data de 01.07.2024  având ca obiect: Raport\nprivind situaţia economică a societăţii  conform actului Raport privind situaţia economică a societăţii\ndin data: 27.06.2024, Depunere situaţii financiare finale ale societăţii lichidate  conform actului\nSituaţie financiară finală de lichidare din data: 27.06.2024, modificare date persoane împuternicite,\npotrivit datelor din: Situaţie financiară finală de lichidare din 27.06.2024; Raport privind situaţia\neconomică a societăţii din 27.06.2024 .\nDispune publicarea prezentei încheieri precum şi a situaţiei financiare finale de lichidare în\nBuletinul Electronic al Registrului Comerţului.\nExecutorie.\nCu drept de plângere, în termen de 10 zile, la Tribunalul Brăila în condițiile art.112 și art.113\ndin Legea nr. 265/2022 privind registrul comerțului și pentru modificarea și completarea altor acte\nnormative cu incidență asupra înregistrării în registrul comerțului.\nPronunțată în data de: 02.07.2024"
22235/01.07.2024,4488,02.07.2024,SINCOM LIVE MANAGEMENT S.R.L.,"Municipiul Brăila, Strada DUDULUI, Nr. 4, Bloc 28, Scara 3, Etaj parter, Ap. 21, Judet",Brăila,39747061,J9/553/2018,ROONRC.J9/553/2018,Maria Cristina Covașă,TOBOŞARU  SIMONA,administrator al  SINCOM LIVE MANAGEMENT S.R.L.,"înscriere  mențiuni , referitoare la  sedii secundare; solicitant declaraţii şi înregistrarea datelor din declarația pe  propria răspundere cu privire la îndeplinirea condițiilor de  funcționarea/desfășurarea a activității","Admite cererea înregistrată sub nr. 22235 din data de 01.07.2024  având ca obiect: sedii \nsecundare; solicitant declaraţii, înregistrarea datelor din declarația pe propria răspundere cu privire la \nîndeplinirea condițiilor de  funcționarea/desfășurarea a activității, potrivit datelor din: Declarație pe \nproprie răspundere cu privire la îndeplinirea condițiilor de funcționare/desfășurare a activității nr. 22235 \ndin 01.07.2024; Decizie asociat unic nr. 1 din 28.06.2024 . \nDispune publicarea prezentei încheieri în Buletinul Electronic al Registrului Comerţului.  \n \nExecutorie. \n \nCu drept de plângere, în termen de 10 zile, la Tribunalul Brăila în condițiile art.112 și art.113 din \nLegea nr. 265/2022 privind registrul comerțului și pentru modificarea și completarea altor acte \nnormative cu incidență asupra înregistrării în registrul comerțului. \n \nPronunțată în data de: 02.07.2024"
21944/27.06.2024,4481,03.07.2024,SCV DONAU S.R.L.,"Sat Vădeni, Comuna Vădeni, Strada Zagna, Nr. 2, Judet Brăila",Brăila,48912710,J9/711/2023,ROONRC.J9/711/2023,Cecilia Dorobăț,MOCANU CONSTANTIN,administrator al  SCV DONAU S.R.L.,"înscriere mențiuni, referitoare la solicitant declaraţii şi înregistrarea datelor din declarația pe propria răspundere cu privire la îndeplinirea condițiilor de  funcționarea/desfășurarea a activității.","Respinge cererea înregistrată sub nr. 21944 din data de 27.06.2024  având ca obiect: solicitant\ndeclaraţii înregistrarea datelor din declarația pe propria răspundere cu privire la îndeplinirea condițiilor\nde  funcționarea/desfășurarea a activității, potrivit datelor din: Declarație pe proprie răspundere cu\nprivire la îndeplinirea condițiilor de funcționare/desfășurare a activității nr. 21944 din 27.06.2024.\nDispune publicarea prezentei încheieri în Buletinul Electronic al Registrului Comerţului.\nExecutorie.\nCu drept de plângere, în termen de 10 zile, la Tribunalul Brăila în condițiile art.112 și art.113\ndin Legea nr. 265/2022 privind registrul comerțului și pentru modificarea și completarea altor acte\nnormative cu incidență asupra înregistrării în registrul comerțului.\nPronunțată în data de: 02.07.2024"
22202,4446,03.07.2024,HANUL PIRAȚILOR S.R.L.,"Municipiul Brăila, Strada VĂDENI, Nr. 15, Constructia C10, C11, C20, Judet Brăila",Brăila,50306937,J9/428/2024,,Cecilia Dorobăț,,,,"Admite cererea înregistrată sub numărul 22202 din data de 01.07.2024, autorizează constituirea\na HANUL PIRAȚILOR S.R.L., cu următoarele date:\n - sediul social: Municipiul Brăila, Strada VĂDENI, Nr. 15, Constructia C10, C11, C20, Judet Brăila\n - domeniul principal de activitate: grupa CAEN:\n107 - Fabricarea produselor de brutărie și a produselor făinoase\n - activitate principală:\n1071 - Fabricarea pâinii; fabricarea prăjiturilor și a produselor proaspete de patiserie\n - capital social:200 LEI, total părți sociale: 20 a câte 10 LEI fiecare\n - fondatori:\n1. TEODORESCU CAMELIA, cu domiciliu în Judet Brăila, Municipiul Brăila.\n - administrator:\n1. TEODORESCU CAMELIA, cu domiciliu în Judet Brăila, Municipiul Brăila.\n - durata de funcționare: nedeterminată; \nDispune înregistrarea în registrul comerțului a datelor din declarația pe propria răspundere cu\nprivire la îndeplinirea condițiilor de  funcționarea/desfășurarea a activității.\nDispune publicarea în Monitorul Oficial al României, Partea a IV-a, a extrasului prezentei\nîncheieri.\nDispune publicarea prezentei încheieri în Buletinul Electronic al Registrului Comerțului.\nExecutorie\nCu drept de plângere, în termen de 10 zile, la Tribunalul Brăila în condițiile art. 112 și art. 113\ndin Legea nr. 265/2022 privind registrul comerțului și pentru modificarea și completarea altor acte\nnormative cu incidență asupra înregistrării în registrul comerțului.\nPronunţată în data de: 02.07.2024\n1\n52"
22243/01.07.2024,4494,02.07.2024,ALBU I.COSTICĂ ÎNTREPRINDERE INDIVIDUALĂ,"Municipiul Brăila, Strada GRIVIŢEI, Nr. 170, Judet Brăila",Brăila,40307323,F9/550/2018,ROONRC.F9/550/2018,Maria Cristina Covașă,ALBU  COSTICĂ,titular întreprindere individuala  al ALBU I.COSTICĂ ÎNTREPRINDERE  INDIVIDUALĂ,radierea firmei din registrul comerțului.,"Admite cererea înregistrată sub nr. 22243 din data de 01.07.2024  având ca obiect: \nradiere firmă \nDispune publicarea prezentei încheieri în Buletinul Electronic al Registrului Comerţului. \n \nExecutorie. \n \nCu drept de plângere, în termen de 10 zile, la judecătoria în a cărei rază teritorială se află sediul \nprofesional al solicitantului, în condițiile art.112 și art.113 din Legea nr. 265/2022 privind registrul \ncomerțului și pentru modificarea și completarea altor acte normative cu incidență asupra înregistrării în \nregistrul comerțului. \n \nPronunțată în data de: 02.07.2024"
22262/01.07.2024,4443,02.07.2024,FIRST ONE PRODUCTION S.R.L.,"Municipiul Brăila, Strada INDUSTRIA SÂRMEI, Nr. 8, Constructia C100, Judet Brăila",Brăila,48708940,J9/605/2023,ROONRC.J9/605/2023,Adriana-Florentina Mihăilescu,KLIER  IOAN,administrator al  FIRST ONE PRODUCTION S.R.L.,"înscriere mențiuni ,  referitoare la  reluare activitate firma de la 01.07.2024; solicitant declaraţii şi înregistrarea datelor din  declarația pe propria răspundere cu privire la îndeplinirea condițiilor de  funcționarea/desfășurarea a  activității","Admite cererea înregistrată sub nr. 22262 din data de 01.07.2024  având ca obiect: reluare \nactivitate firma de la 01.07.2024; solicitant declaraţii, înregistrarea datelor din declarația pe propria \nrăspundere cu privire la îndeplinirea condițiilor de  funcționarea/desfășurarea a activității, potrivit \ndatelor din: Decizie asociat unic nr. 1 din 01.07.2024; Declarație pe proprie răspundere cu privire la \nîndeplinirea condițiilor de funcționare/desfășurare a activității nr. 22262 din 01.07.2024 . \nDispune publicarea prezentei încheieri în Buletinul Electronic al Registrului Comerţului.  \n \nExecutorie. \n \nCu drept de plângere, în termen de 10 zile, la Tribunalul Brăila în condițiile art.112 și art.113 din \nLegea nr. 265/2022 privind registrul comerțului și pentru modificarea și completarea altor acte \nnormative cu incidență asupra înregistrării în registrul comerțului. \n \nPronunțată în data de: 02.07.2024"
22203/01.07.2024,4475,03.07.2024,GOGOŞERIA EMANUEL 2020 S.R.L.,"Municipiul Brăila, Strada OBORULUI, Nr. 6, Bloc 24, Scara 3, Etaj 2, Ap. 58, Judet",Brăila,42900083,J9/505/2020,ROONRC.J9/505/2020,Cecilia Dorobăț,ENACHE VASILE,administrator al  GOGOŞERIA EMANUEL 2020 S.R.L.,radierea firmei din registrul comerțului,"Admite cererea înregistrată sub nr. 22203 din data de 01.07.2024  având ca obiect: radiere\nfirmă  Motivul radierii este voința profesionistului.\nDispune publicarea prezentei încheieri în Buletinul Electronic al Registrului Comerţului.\nExecutorie.\nCu drept de plângere, în termen de 10 zile, la Tribunalul Brăila în condițiile art.112 și art.113\ndin Legea nr. 265/2022 privind registrul comerțului și pentru modificarea și completarea altor acte\nnormative cu incidență asupra înregistrării în registrul comerțului.\nPronunțată în data de: 02.07.2024"
22192/01.07.2024,4485,03.07.2024,GURGU GAVRILĂ PERSOANĂ FIZICĂ AUTORIZATĂ,"Municipiul Brăila, Strada SEBEŞULUI, Nr. 3, Bloc J, Scara 4, Ap. 65, Judet Brăila",Brăila,43277553,F9/428/2020,ROONRC.F9/428/2020,Cecilia Dorobăț,GURGU GAVRILĂ,persoana fizica autorizata  al GURGU GAVRILĂ PERSOANĂ FIZICĂ AUTORIZATĂ,radierea firmei din registrul comerțului.,"Admite cererea înregistrată sub nr. 22192 din data de 01.07.2024  având ca obiect:\nradiere firmă\nDispune publicarea prezentei încheieri în Buletinul Electronic al Registrului Comerţului.\nExecutorie.\nCu drept de plângere, în termen de 10 zile, la judecătoria în a cărei rază teritorială se află sediul\nprofesional al solicitantului, în condițiile art.112 și art.113 din Legea nr. 265/2022 privind registrul\ncomerțului și pentru modificarea și completarea altor acte normative cu incidență asupra înregistrării\nîn registrul comerțului.\nPronunțată în data de: 02.07.2024"
22298/01.07.2024,4471,02.07.2024,TELCOLI SRL,"Loc. Făurei, Oraş Făurei, Str. REPUBLICII, Bloc B1A2, Scara 1, Ap. 5, Judet Brăila",Brăila,19036137,J9/750/2006,ROONRC.J09/750/2006,Adriana-Florentina Mihăilescu,CII NIȚU  ȘTEFANIA prin NIȚU ȘTEFANIA,"lichidator, pentru  TELCOLI SRL","înscriere  mențiuni , referitoare la  Raport privind situaţia economică a societăţii  conform actului Raport privind  situaţia economică a societăţii din data: 11.02.2024","Admite cererea înregistrată sub nr. 22298 din data de 01.07.2024  având ca obiect: Raport privind \nsituaţia economică a societăţii  conform actului Raport privind situaţia economică a societăţii din data: \n11.02.2024, potrivit datelor din: Raport privind situaţia economică a societăţii din 11.02.2024 . \nDispune publicarea prezentei încheieri în Buletinul Electronic al Registrului Comerţului.  \n \nExecutorie. \n \nCu drept de plângere, în termen de 10 zile, la Tribunalul Brăila în condițiile art.112 și art.113 din \nLegea nr. 265/2022 privind registrul comerțului și pentru modificarea și completarea altor acte \nnormative cu incidență asupra înregistrării în registrul comerțului. \n \nPronunțată în data de: 02.07.2024"
22257/01.07.2024,4469,02.07.2024,ELEMENT LOGISTIC BRAILA S.R.L.,"Municipiul Brăila, Strada INDUSTRIA SÂRMEI, Nr. 8, Constructia C16, Judet Brăila",Brăila,48706729,J9/603/2023,ROONRC.J9/603/2023,Maria Cristina Covașă,STRATULAT GABRIEL,administrator al  ELEMENT LOGISTIC BRAILA S.R.L.,"înscriere mențiuni , referitoare la  reluare activitate firma de la 01.07.2024; solicitant declaraţii  şi înregistrarea datelor din declarația pe propria răspundere cu privire la îndeplinirea condițiilor de   funcționarea/desfășurarea a activității","Admite cererea înregistrată sub nr. 22257 din data de 01.07.2024  având ca obiect: reluare \nactivitate firma de la 01.07.2024; solicitant declaraţii, înregistrarea datelor din declarația pe propria \nrăspundere cu privire la îndeplinirea condițiilor de  funcționarea/desfășurarea a activității, potrivit \ndatelor din: Declarație pe proprie răspundere cu privire la îndeplinirea condițiilor de \nfuncționare/desfășurare a activității nr. 22257 din 01.07.2024; Decizie asociat unic nr. 1 din 01.07.2024 \n. \nDispune publicarea prezentei încheieri în Buletinul Electronic al Registrului Comerţului.  \n \nExecutorie. \n \nCu drept de plângere, în termen de 10 zile, la Tribunalul Brăila în condițiile art.112 și art.113 din \nLegea nr. 265/2022 privind registrul comerțului și pentru modificarea și completarea altor acte \nnormative cu incidență asupra înregistrării în registrul comerțului. \n \nPronunțată în data de: 02.07.2024"
22211/01.07.2024,4449,02.07.2024,NINA MST S.R.L.,"Sat Bărăganul, Comuna Bărăganul, Strada CIOCÂRLIEI, Nr. 7, Judet Brăila",Brăila,43497419,J9/838/2020,ROONRC.J9/838/2020,Maria Cristina Covașă,MUSTĂŢEA  NICOLETA-ADELA,administrator al  NINA MST S.R.L.,"înscriere mențiuni ,  referitoare la  Depunere act constitutiv actualizat (art.204 din Legea nr. 31/1990)  conform actului Act  constitutiv actualizat din data: 06.06.2024, modificare date asociaţi persoane fizice; modificare date  persoane împuternicite","Admite cererea înregistrată sub nr. 22211 din data de 01.07.2024  având ca obiect: Depunere act \nconstitutiv actualizat (art.204 din Legea nr. 31/1990)  conform actului Act constitutiv actualizat din data: \n06.06.2024, modificare date asociaţi persoane fizice; modificare date persoane împuternicite, potrivit \ndatelor din: Decizie asociat unic nr. 2 din 06.06.2024; depunerea actului constitutiv actualizat . \nDispune publicarea prezentei încheieri în Buletinul Electronic al Registrului Comerţului.\n \nDispune publicarea în Monitorul Oficial al României, Partea a IV-a, a următoarelor acte: Decizie \nasociat unic nr. 2 din 06.06.2024 şi a notificării privind depunerea la oficiul registrului comerţului a \nactului constitutiv actualizat. \n \nExecutorie. \n \nCu drept de plângere, în termen de 10 zile, la Tribunalul Brăila în condițiile art.112 și art.113 din \nLegea nr. 265/2022 privind registrul comerțului și pentru modificarea și completarea altor acte \nnormative cu incidență asupra înregistrării în registrul comerțului. \n \nPronunțată în data de: 02.07.2024"
22180/01.07.2024,4461,03.07.2024,LVL UP SOLUTIONS S.R.L.,"Municipiul Brăila, Strada COMUNARZI, Nr. 11, Bloc A17, Scara 2, Etaj 3, Ap. 34,",Brăila,49117454,J9/832/2023,ROONRC.J9/832/2023,Cecilia Dorobăț,CRISTEA VLAD,administrator al  LVL UP SOLUTIONS S.R.L.,"înscriere mențiuni , referitoare la  sedii secundare","Admite cererea înregistrată sub nr. 22180 din data de 01.07.2024  având ca obiect: sedii\nsecundare, potrivit datelor din: Hotărârea adunării generale a asociaţilor nr. 1 din 28.06.2024 .\nDispune publicarea prezentei încheieri în Buletinul Electronic al Registrului Comerţului.\nExecutorie.\nCu drept de plângere, în termen de 10 zile, la Tribunalul Brăila în condițiile art.112 și art.113\ndin Legea nr. 265/2022 privind registrul comerțului și pentru modificarea și completarea altor acte\nnormative cu incidență asupra înregistrării în registrul comerțului.\nPronunțată în data de: 02.07.2024"
17324/19.06.2024,4467,03.07.2024,INVPROIECT SRL,"Municipiul Brăila, Bulevardul DOROBANŢILOR, Nr. 740, Judet Brăila",Brăila,32090621,J9/501/2013,ROONRC.J9/501/2013,Cecilia Dorobăț,BELICIU CORNEL,administrator al  INVPROIECT SRL,"înscriere mențiuni , referitoare la modificare date sediu social; Depunere act constitutiv actualizat (art.204 din Legea nr. 31/1990) conform actului Act constitutiv actualizat  avand numarul 1 din data: 18.06.2024, solicitant declaraţii şi înregistrarea datelor din declarația pe propria răspundere cu privire la îndeplinirea condițiilor de funcționarea/desfășurarea a activității","Admite cererea înregistrată sub nr. 17324 din data de 19.06.2024  având ca obiect: modificare\ndate sediu social; Depunere act constitutiv actualizat (art.204 din Legea nr. 31/1990)  conform actului\nAct constitutiv actualizat  avand numarul 1 din data: 18.06.2024, solicitant declaraţii, înregistrarea\ndatelor  din  declarația  pe  propria  răspundere  cu  privire  la  îndeplinirea  condițiilor  de\nfuncționarea/desfășurarea a activității, potrivit datelor din: Hotărâre asociat unic nr. 1 din 17.06.2024;\nDeclarație pe proprie răspundere cu privire la îndeplinirea condițiilor de funcționare/desfășurare a\nactivității nr. 17324 din 19.06.2024; depunerea actului constitutiv actualizat .\nDispune  publicarea  prezentei  încheieri  în  Buletinul  Electronic  al  Registrului  Comerţului.\nDispune publicarea în Monitorul Oficial al României, Partea a IV-a, a următoarelor acte:\nHotărâre asociat unic nr. 1 din 17.06.2024 şi a notificării privind depunerea la oficiul registrului\ncomerţului a actului constitutiv actualizat.\nExecutorie.\nCu drept de plângere, în termen de 10 zile, la Tribunalul Brăila în condițiile art.112 și art.113\ndin Legea nr. 265/2022 privind registrul comerțului și pentru modificarea și completarea altor acte\nnormative cu incidență asupra înregistrării în registrul comerțului.\nPronunțată în data de: 02.07.2024"
22184/01.07.2024,4463,03.07.2024,BEST OMEGA LOGISTIC S.R.L.,"Sat Cazasu, Comuna Cazasu, Strada Cicoarei, Nr. 37, Judet Brăila",Brăila,31242705,J9/108/2013,ROONRC.J9/108/2013,Cecilia Dorobăț,BUZEA DANIEL IONUŢ,administrator al  BEST OMEGA LOGISTIC S.R.L.,"înscriere mențiuni , referitoare la  Depunere act constitutiv actualizat (art.204 din Legea nr. 31/1990)  conform actului Act constitutiv actualizat din data: 01.07.2024, modificare date, adăugare asociaţi persoane fizice; numire, modificare puteri persoane împuternicite","Admite cererea înregistrată sub nr. 22184 din data de 01.07.2024  având ca obiect: Depunere\nact constitutiv actualizat (art.204 din Legea nr. 31/1990)  conform actului Act constitutiv actualizat din\ndata:  01.07.2024,  modificare  date,  adăugare  asociaţi  persoane  fizice;  numire,  modificare  puteri\npersoane  împuternicite,  potrivit  datelor  din:  Hotărâre  nr.  1  din  01.07.2024;  depunerea  actului\nconstitutiv actualizat .\nDispune  publicarea  prezentei  încheieri  în  Buletinul  Electronic  al  Registrului  Comerţului.\nDispune publicarea în Monitorul Oficial al României, Partea a IV-a, a următoarelor acte:\nHotărâre nr. 1 din 01.07.2024 şi a notificării privind depunerea la oficiul registrului comerţului a\nactului constitutiv actualizat.\nExecutorie.\nCu drept de plângere, în termen de 10 zile, la Tribunalul Brăila în condițiile art.112 și art.113\ndin Legea nr. 265/2022 privind registrul comerțului și pentru modificarea și completarea altor acte\nnormative cu incidență asupra înregistrării în registrul comerțului.\nPronunțată în data de: 02.07.2024"
22300/01.07.2024,4474,02.07.2024,LOZCAZ SRL,"Sat Cazasu, Comuna Cazasu, ""CLADIRE BRUTARIE"", Judet Brăila",Brăila,21730741,J9/455/2007,ROONRC.J09/455/2007,Adriana-Florentina Mihăilescu,ANOVA  INSOLVENCY IPURL prin CRISTIAN ANCA-LILIANA,"lichidator, pentru  LOZCAZ  SRL","înscriere mențiuni , referitoare la  Raport privind situaţia economică a societăţii  conform  actului Raport privind situaţia economică a societăţii  avand numarul 617 din data: 28.06.2024","Admite cererea înregistrată sub nr. 22300 din data de 01.07.2024  având ca obiect: Raport privind \nsituaţia economică a societăţii  conform actului Raport privind situaţia economică a societăţii  avand \nnumarul 617 din data: 28.06.2024, potrivit datelor din: Raport privind situaţia economică a societăţii nr. \n617 din 28.06.2024 . \nDispune publicarea prezentei încheieri în Buletinul Electronic al Registrului Comerţului.  \n \nExecutorie. \n \nCu drept de plângere, în termen de 10 zile, la Tribunalul Brăila în condițiile art.112 și art.113 din \nLegea nr. 265/2022 privind registrul comerțului și pentru modificarea și completarea altor acte \nnormative cu incidență asupra înregistrării în registrul comerțului. \n \nPronunțată în data de: 02.07.2024"
