dossier_number,decision_number,pronounced_date,firm_name,address,county,registration_code,registration_order,euid,registrator,requestor,quality,request_details,disposition_text
22139/28.06.2024,4434,01.07.2024,NICOLAE MARIAN-FLORIN ÎNTREPRINDERE INDIVIDUALĂ,"Sat Romanu, Comuna Romanu, Strada SFATULUI, Nr. 23 E, Judet Brăila",Brăila,31735398,F9/509/2013,ROONRC.F9/509/2013,Maria Cristina Covașă,NICOLAE  MARIAN-FLORIN,titular întreprindere individuala al NICOLAE MARIAN-FLORIN  ÎNTREPRINDERE INDIVIDUALĂ,"înscriere mențiuni, referitoare la  cod obiect de activitate;  text obiect de activitate; modificare date asociaţi persoane fizice; solicitant declaraţii şi înregistrarea  datelor din declarația pe propria răspundere cu privire la îndeplinirea condițiilor de   funcționarea/desfășurarea a activității.","Admite cererea înregistrată sub nr. 22139 din data de 28.06.2024  având ca obiect: cod obiect de \nactivitate; text obiect de activitate; modificare date asociaţi persoane fizice; solicitant declaraţii, \nînregistrarea datelor din declarația pe propria răspundere cu privire la îndeplinirea condițiilor de  \nfuncționarea/desfășurarea a activității, potrivit datelor din: Declarație pe proprie răspundere cu privire \nla îndeplinirea condițiilor de funcționare/desfășurare a activității nr. 22139 din 28.06.2024. \nDispune publicarea prezentei încheieri în Buletinul Electronic al Registrului Comerţului. \n \nExecutorie. \n \nCu drept de plângere, în termen de 10 zile, judecătoria în a cărei rază teritorială se află sediul \nprofesional al solicitantului, în condițiile art.112 și art.113 din Legea nr. 265/2022 privind registrul \ncomerțului și pentru modificarea și completarea altor acte normative cu incidență asupra înregistrării în \nregistrul comerțului. \n \nPronunțată în data de: 01.07.2024"
22129/28.06.2024,4428,01.07.2024,GIEFF FASIHON SRL,"Municipiul Brăila, Strada OBORULUI, Nr. 16, Judet Brăila",Brăila,24208166,J9/653/2008,ROONRC.J09/653/2008,Maria Cristina Covașă,IRAȘCU  VIOREL,administrator al  GIEFF FASIHON SRL,"înscriere mențiuni , referitoare  la  transmitere părţi sociale pentru persoane fizice; Depunere act constitutiv actualizat (art.204 din Legea  nr. 31/1990)  conform actului Act constitutiv actualizat din data: 17.06.2024, adăugare, retragere asociaţi  persoane fizice; revocare, numire persoane împuternicite","Admite cererea înregistrată sub nr. 22129 din data de 28.06.2024  având ca obiect: transmitere \npărţi sociale pentru persoane fizice; Depunere act constitutiv actualizat (art.204 din Legea nr. 31/1990)  \nconform actului Act constitutiv actualizat din data: 17.06.2024, adăugare, retragere asociaţi persoane \nfizice; revocare, numire persoane împuternicite, potrivit datelor din: Decizie asociat unic nr. 1 din \n17.06.2024; depunerea actului constitutiv actualizat . \nDispune publicarea prezentei încheieri în Buletinul Electronic al Registrului Comerţului.\n \nDispune publicarea în Monitorul Oficial al României, Partea a IV-a, a următoarelor acte: Decizie \nasociat unic nr. 1 din 17.06.2024 şi a notificării privind depunerea la oficiul registrului comerţului a \nactului constitutiv actualizat. \n \nExecutorie. \n \nCu drept de plângere, în termen de 10 zile, la Tribunalul Brăila în condițiile art.112 și art.113 din \nLegea nr. 265/2022 privind registrul comerțului și pentru modificarea și completarea altor acte \nnormative cu incidență asupra înregistrării în registrul comerțului. \n \nPronunțată în data de: 01.07.2024"
22122/28.06.2024,4419,02.07.2024,OBREMAT COMPANY S.R.L.,"Municipiul Brăila, Strada SIRET, Nr. 10-12, Bloc S4A+S4B, Scara 1-S4A, Etaj 3, Ap. 8,",Brăila,48421349,J9/465/2023,ROONRC.J9/465/2023,Cecilia Dorobăț,OBRETIN ANGELA-MIHAELA,administrator al  OBREMAT COMPANY S.R.L.,"înscriere mențiuni , referitoare la  transmitere părţi sociale pentru persoane fizice; Depunere act constitutiv actualizat  (art.204 din Legea nr. 31/1990)  conform actului  Act constitutiv  actualizat  din data: 27.06.2024, adăugare, retragere asociaţi persoane fizice; revocare, numire persoane împuternicite","Admite cererea înregistrată sub nr. 22122 din data de 28.06.2024  având ca obiect: transmitere\npărţi sociale pentru persoane fizice; Depunere act constitutiv actualizat (art.204 din Legea nr. 31/1990)\nconform actului Act constitutiv actualizat din data: 27.06.2024, adăugare, retragere asociaţi persoane\nfizice; revocare, numire persoane împuternicite, potrivit datelor din: Decizie asociat unic nr. 2 din\n27.06.2024; depunerea actului constitutiv actualizat .\nDispune  publicarea  prezentei  încheieri  în  Buletinul  Electronic  al  Registrului  Comerţului.\nDispune publicarea în Monitorul Oficial al României, Partea a IV-a, a următoarelor acte:\nDecizie asociat unic nr. 2 din 27.06.2024 şi a notificării privind depunerea la oficiul registrului\ncomerţului a actului constitutiv actualizat.\nExecutorie.\nCu drept de plângere, în termen de 10 zile, la Tribunalul Brăila în condițiile art.112 și art.113\ndin Legea nr. 265/2022 privind registrul comerțului și pentru modificarea și completarea altor acte\nnormative cu incidență asupra înregistrării în registrul comerțului.\nPronunțată în data de: 01.07.2024"
22118/28.06.2024,4415,02.07.2024,FLOBO INSTAL S.R.L.,"Municipiul Brăila, Strada ŞTEFAN CEL MARE, Nr. 548, Judet Brăila",Brăila,47897108,J9/235/2023,ROONRC.J9/235/2023,Cecilia Dorobăț,SPULBER DRAGOS-COSTEL,administrator al  FLOBO INSTAL S.R.L.,"înscriere mențiuni , referitoare la  Dizolvare si lichidare conform art.227 alin.(1), lit.d si art.235 din Legea nr. 31/1990","Admite cererea înregistrată sub nr. 22118 din data de 28.06.2024  având ca obiect: Dizolvare si\nlichidare conform art.227 alin.(1), lit.d si art.235 din Legea nr. 31/1990, potrivit datelor din: Decizie\nasociat unic nr. 1 din 27.06.2024 .\nDispune  publicarea  prezentei  încheieri  în  Buletinul  Electronic  al  Registrului  Comerţului.\nDispune publicarea în Monitorul Oficial al României, Partea a IV-a, a următoarelor acte:\nDecizie asociat unic nr. 1 din 27.06.2024.\nExecutorie.\nCu drept de plângere, în termen de 10 zile, la Tribunalul Brăila în condițiile art.112 și art.113\ndin Legea nr. 265/2022 privind registrul comerțului și pentru modificarea și completarea altor acte\nnormative cu incidență asupra înregistrării în registrul comerțului.\nPronunțată în data de: 01.07.2024"
22130/28.06.2024,4429,01.07.2024,GARPLUSAGRO S.R.L.,"Municipiul Brăila, Strada MIHAI BRAVU, Nr. 292-294, Judet Brăila",Brăila,42893008,J9/499/2020,ROONRC.J9/499/2020,Maria Cristina Covașă,FILIPESCU  MONICA,administrator al  GARPLUSAGRO S.R.L.,"înscriere mențiuni ,  referitoare la  solicitant declaraţii şi înregistrarea datelor din declarația pe propria răspundere cu privire  la îndeplinirea condițiilor de  funcționarea/desfășurarea a activității","Admite cererea înregistrată sub nr. 22130 din data de 28.06.2024  având ca obiect: solicitant \ndeclaraţii, înregistrarea datelor din declarația pe propria răspundere cu privire la îndeplinirea condițiilor \nde  funcționarea/desfășurarea a activității, potrivit datelor din: Declarație pe proprie răspundere cu \nprivire la îndeplinirea condițiilor de funcționare/desfășurare a activității nr. 22130 din 28.06.2024 . \nDispune publicarea prezentei încheieri în Buletinul Electronic al Registrului Comerţului.  \n \nExecutorie. \n \nCu drept de plângere, în termen de 10 zile, la Tribunalul Brăila în condițiile art.112 și art.113 din \nLegea nr. 265/2022 privind registrul comerțului și pentru modificarea și completarea altor acte \nnormative cu incidență asupra înregistrării în registrul comerțului. \n \nPronunțată în data de: 01.07.2024"
22207/01.07.2024,4479,02.07.2024,B.M. AZIMUTH MEDIA S.R.L.,"Municipiul Brăila, Bulevardul INDEPENDENŢEI, Nr. 103, Judet Brăila",Brăila,47183389,J9/878/2022,ROONRC.J9/878/2022,Cecilia Dorobăț,B.E.J.  EFTENE PETRUT,executor judecătoresc al  B.M. AZIMUTH MEDIA S.R.L.,"înscriere mențiuni referitoare la sechestru asigurător instituit asupra părților sociale, potrivit datelor din  Proces verbal (sechestru definitiv) încheiat la data de 28.06.2024, în Dosar executare 920/EP/2021.","Admite cererea înregistrată sub nr. 22207 din data de 01.07.2024  având ca obiect: sechestru \nasigurător instituit asupra părților sociale, potrivit datelor din: Proces verbal (sechestru definitiv) \nîncheiat la data de 28.06.2024, în Dosar executare 920/EP/2021. \nDispune publicarea prezentei încheieri în Buletinul Electronic al Registrului Comerţului.  \n \nExecutorie. \n \nCu drept de plângere, în termen de 10 zile, la Tribunalul Brăila în condițiile art.112 și art.113 \ndin Legea nr. 265/2022 privind registrul comerțului și pentru modificarea și completarea altor acte \nnormative cu incidență asupra înregistrării în registrul comerțului. \n \nPronunțată în data de: 02.07.2024"
16994/13.06.2024,4391,02.07.2024,VIDACAM COM SRL,"Sat Viziru, Comuna Viziru, Strada BRĂILEI, Nr. 136, Constructia C2, Judet Brăila",Brăila,13664728,J9/376/2000,ROONRC.J09/376/2000,Cecilia Dorobăț,VISALON ANICUTA,administrator al  VIDACAM COM SRL,radierea firmei din registrul comerțului.,"Respinge cererea înregistrată sub nr. 16994 din data de 13.06.2024  având ca obiect: radiere\nfirmă .\nDispune publicarea prezentei încheieri în Buletinul Electronic al Registrului Comerţului.\nExecutorie.\nCu drept de plângere, în termen de 10 zile, la Tribunalul Brăila în condițiile art.112 și art.113\ndin Legea nr. 265/2022 privind registrul comerțului și pentru modificarea și completarea altor acte\nnormative cu incidență asupra înregistrării în registrul comerțului.\nPronunțată în data de: 01.07.2024"
22145/28.06.2024,4437,01.07.2024,MEDICAL HELP SRL,"Municipiul Brăila, Strada PLEVNA, Nr. 259, Judet Brăila",Brăila,13408347,J9/265/2000,ROONRC.J09/265/2000,Maria Cristina Covașă,MUNICIPIUL BRAILA DIRECTIA FINANTELOR PUBLICE LOCALE SERVICIUL URMARIRE  INCASARE IMPOZITE SI EXECUTARI SILITE prin DRAGOMIR MARIAN VIOREL,"reprezentant, pentru  MEDICAL HELP SRL","înscriere mențiuni , referitoare la  Opoziţie  împotriva hotărârii adunării generale","Admite cererea înregistrată sub nr. 22145 din data de 28.06.2024  având ca obiect: Opoziţie \nîmpotriva hotărârii adunării generale . \nDispune publicarea prezentei încheieri în Buletinul Electronic al Registrului Comerţului.  \n \nExecutorie. \n \nCu drept de plângere, în termen de 10 zile, la Tribunalul Brăila în condițiile art.112 și art.113 din \nLegea nr. 265/2022 privind registrul comerțului și pentru modificarea și completarea altor acte \nnormative cu incidență asupra înregistrării în registrul comerțului. \n \nPronunțată în data de: 01.07.2024"
22131/28.06.2024,4430,01.07.2024,ERIC TRANSCARGO S.R.L.,"Municipiul Brăila, Strada CELULOZEI, Nr. 40, Bloc MESTEACAN, Scara 1, Etaj 1,",Brăila,43488100,J9/827/2020,ROONRC.J9/827/2020,Maria Cristina Covașă,RÂCU  VALENTINA-RAMONA,administrator al  ERIC TRANSCARGO S.R.L.,"înscriere  mențiuni , referitoare la  modificare stare firmă; Dizolvare si lichidare conform art.227 alin.(1), lit.d si  art.235 din Legea nr. 31/1990","Admite cererea înregistrată sub nr. 22131 din data de 28.06.2024  având ca obiect: modificare \nstare firmă; Dizolvare si lichidare conform art.227 alin.(1), lit.d si art.235 din Legea nr. 31/1990, potrivit \ndatelor din: Decizie asociat unic nr. 2 din 27.06.2024 . \nDispune publicarea prezentei încheieri în Buletinul Electronic al Registrului Comerţului.\n \nDispune publicarea în Monitorul Oficial al României, Partea a IV-a, a următoarelor acte: Decizie \nasociat unic nr. 2 din 27.06.2024. \n \nExecutorie. \n \nCu drept de plângere, în termen de 10 zile, la Tribunalul Brăila în condițiile art.112 și art.113 din \nLegea nr. 265/2022 privind registrul comerțului și pentru modificarea și completarea altor acte \nnormative cu incidență asupra înregistrării în registrul comerțului. \n \nPronunțată în data de: 01.07.2024"
17441/21.06.2024,4405,01.07.2024,PLOIANU D. GHEORGHE ÎNTREPRINDERE INDIVIDUALĂ,"Municipiul Brăila, Str. TRANSILVANIEI, Nr. 42A, Judet Brăila",Brăila,26110910,F9/942/2009,ROONRC.F09/942/2009,Maria Cristina Covașă,PLOIANU  GHEORGHE,titular întreprindere individuala al PLOIANU D. GHEORGHE  ÎNTREPRINDERE INDIVIDUALĂ,"înscriere mențiuni, referitoare la  modificare date asociaţi  persoane fizice .","Admite cererea înregistrată sub nr. 17441 din data de 21.06.2024  având ca obiect: modificare \ndate asociaţi persoane fizice. \nDispune publicarea prezentei încheieri în Buletinul Electronic al Registrului Comerţului. \n \nExecutorie. \n \nCu drept de plângere, în termen de 10 zile, judecătoria în a cărei rază teritorială se află sediul \nprofesional al solicitantului, în condițiile art.112 și art.113 din Legea nr. 265/2022 privind registrul \ncomerțului și pentru modificarea și completarea altor acte normative cu incidență asupra înregistrării în \nregistrul comerțului. \n \nPronunțată în data de: 01.07.2024"
21983/27.06.2024,4401,02.07.2024,,,Brăila,,,,Cecilia Dorobăț,BARBU FLORIAN,administrator al  BARBGIULI S.R.L.,"înmatricularea, autorizarea constituirii și înregistrarea datelor din declarația pe proprie răspundere în registrul comerțului.","Respinge  cererea  înregistrată  sub  nr.  21983  din  data  de  27.06.2024   având  ca  obiect:\nînregistrarea, autorizarea constituirii și înregistrarea datelor din declarația pe proprie răspundere în\nregistrul comerțului a BARBGIULI S.R.L. .\nDispune publicarea prezentei încheieri în Buletinul Electronic al Registrului Comerțului.\nExecutorie.\nCu drept de plângere, în termen de 10 zile, la Tribunalul Brăila în condițiile art.112 și art.113\ndin Legea nr. 265/2022 privind registrul comerțului și pentru modificarea și completarea altor acte\nnormative cu incidență asupra înregistrării în registrul comerțului.\nPronunțată în data de: 01.07.2024"
22106/28.06.2024,4421,02.07.2024,GRIGORIU DĂNUŢ-CRISTIAN ÎNTREPRINDERE INDIVIDUALĂ,"Municipiul Brăila, Strada ŞCOLILOR, Nr. 28, Bloc D2, Scara 4, Etaj 3, Ap. 59, Judet",Brăila,38186947,F9/423/2017,ROONRC.F9/423/2017,Cecilia Dorobăț,,,,"Admite cererea înregistrată sub nr. 22106 din data de 28.06.2024  având ca obiect: modificare\ndate asociaţi persoane fizice.\nDispune publicarea prezentei încheieri în Buletinul Electronic al Registrului Comerţului.\nExecutorie.\nCu drept de plângere, în termen de 10 zile, judecătoria în a cărei rază teritorială se află sediul\nprofesional al solicitantului, în condițiile art.112 și art.113 din Legea nr. 265/2022 privind registrul\ncomerțului și pentru modificarea și completarea altor acte normative cu incidență asupra înregistrării\nîn registrul comerțului.\nPronunțată în data de: 01.07.2024"
22089/28.06.2024,4392,02.07.2024,CANVICI SRL,"Municipiul Brăila, Str. CODRULUI, Nr. 47 BIS, Judet Brăila",Brăila,27054800,J9/293/2010,ROONRC.J09/293/2010,Cecilia Dorobăț,C.I.I. SANDOR OTILIA-MIHAELA prin SANDOR OTILIA-MIHAELA,"lichidator, pentru CANVICI SRL","înscriere mențiuni , referitoare la  Depunere situaţii financiare finale ale societăţii lichidate  conform actului Raport privind situaţia economică a societăţii  avand numarul 454 din data: 27.06.2024","Admite cererea înregistrată sub nr. 22089 din data de 28.06.2024  având ca obiect: Depunere\nsituaţii financiare finale ale societăţii lichidate  conform actului Raport privind situaţia economică a\nsocietăţii  avand numarul 454 din data: 27.06.2024, potrivit datelor din: Raport privind situaţia\neconomică a societăţii nr. 454 din 27.06.2024 .\nDispune publicarea prezentei încheieri precum şi a situaţiei financiare finale de lichidare în\nBuletinul Electronic al Registrului Comerţului.\nExecutorie.\nCu drept de plângere, în termen de 10 zile, la Tribunalul Brăila în condițiile art.112 și art.113\ndin Legea nr. 265/2022 privind registrul comerțului și pentru modificarea și completarea altor acte\nnormative cu incidență asupra înregistrării în registrul comerțului.\nPronunțată în data de: 01.07.2024"
17002/13.06.2024,4420,02.07.2024,ION D.MARIAN PERSOANĂ FIZICĂ AUTORIZATĂ,"Municipiul Brăila, Strada ŞCOLILOR, Nr. 42, Bloc BPP, Scara 4, Etaj 4, Ap. 65, Judet",Brăila,44218172,F9/190/2021,ROONRC.F9/190/2021,Cecilia Dorobăț,ION MARIAN  în  calitate  de  persoana  fizica  autorizata  al  ION  D.MARIAN  PERSOANĂ  FIZICĂ AUTORIZATĂ,,"înscriere mențiuni, referitoare la  modificare date asociaţi persoane fizice .","Admite cererea înregistrată sub nr. 17002 din data de 13.06.2024  având ca obiect: modificare\ndate asociaţi persoane fizice.\nDispune publicarea prezentei încheieri în Buletinul Electronic al Registrului Comerţului.\nExecutorie.\nCu drept de plângere, în termen de 10 zile, judecătoria în a cărei rază teritorială se află sediul\nprofesional al solicitantului, în condițiile art.112 și art.113 din Legea nr. 265/2022 privind registrul\ncomerțului și pentru modificarea și completarea altor acte normative cu incidență asupra înregistrării\nîn registrul comerțului.\nPronunțată în data de: 01.07.2024"
22138,4390,01.07.2024,SPÂNU ANA-MARIA-SIMONA ÎNTREPRINDERE INDIVIDUALĂ,"Sat Bordei Verde, Comuna Bordei Verde, Strada POLIŢIEI, Nr. 19, Judet Brăila",Brăila,50299821,F9/160/2024,ROONRC.F9/160/2024,Maria Cristina Covașă,,,,"Admite cererea înregistrată sub numărul 22138 din data de 28.06.2024, autorizează constituirea \na SPÂNU ANA-MARIA-SIMONA ÎNTREPRINDERE INDIVIDUALĂ, cu următoarele date: \n \n - sediul profesional: Sat Bordei Verde, Comuna Bordei Verde, Strada POLIȚIEI, Nr. 19, Judet Brăila \n - domeniul principal de activitate: grupa CAEN: \n139 - Fabricarea altor articole textile \n - activitate principală: \n1399 - Fabricarea altor articole textile n.c.a. \n             Titularul întreprinderii individuale:  \n1. SPÂNU ANA-MARIA-SIMONA, cu domiciliu în Judet Brăila, Sat Bordei Verde, Comuna Bordei \nVerde. \nDispune înregistrarea în registrul comerțului a datelor din declarația pe propria răspundere cu \nprivire la îndeplinirea condițiilor de  funcționarea/desfășurarea a activității. \nDispune publicarea prezentei încheieri în Buletinul Electronic al Registrului Comerțului. \nExecutorie \nCu drept de plângere, în termen de 10 zile, la judecătoria în a cărei rază teritorială se află sediul \nprofesional al solicitantului, în condițiile art. 112 și art. 113 din Legea nr. 265/2022 privind registrul \ncomerțului și pentru modificarea și completarea altor acte normative cu incidență asupra înregistrării în \nregistrul comerțului. \nPronunţată în data de: 01.07.2024"
22157/28.06.2024,4438,01.07.2024,DARIA COSMI SRL,"Sat Oprişeneşti, Oraş Ianca, Nr. 223, constructia C1, Judet Brăila",Brăila,16147149,J9/146/2004,ROONRC.J09/146/2004,Maria Cristina Covașă,BURLACU  VASILICA,administrator al  DARIA COSMI SRL,"înscriere mențiuni , referitoare  la  solicitant declaraţii şi înregistrarea datelor din declarația pe propria răspundere cu privire la  îndeplinirea condițiilor de  funcționarea/desfășurarea a activității","Admite cererea înregistrată sub nr. 22157 din data de 28.06.2024  având ca obiect: solicitant \ndeclaraţii, înregistrarea datelor din declarația pe propria răspundere cu privire la îndeplinirea condițiilor \nde  funcționarea/desfășurarea a activității, potrivit datelor din: Declarație pe proprie răspundere cu \nprivire la îndeplinirea condițiilor de funcționare/desfășurare a activității nr. 22157 din 28.06.2024 . \nDispune publicarea prezentei încheieri în Buletinul Electronic al Registrului Comerţului.  \n \nExecutorie. \n \nCu drept de plângere, în termen de 10 zile, la Tribunalul Brăila în condițiile art.112 și art.113 din \nLegea nr. 265/2022 privind registrul comerțului și pentru modificarea și completarea altor acte \nnormative cu incidență asupra înregistrării în registrul comerțului. \n \nPronunțată în data de: 01.07.2024"
22101,4389,01.07.2024,CONDRUZ MIOARA PERSOANĂ FIZICĂ AUTORIZATĂ,"Municipiul Brăila, Strada SIMION BĂRNUŢIU, Nr. 18, Bloc A26, Scara 1, Etaj",Brăila,50299813,F9/159/2024,ROONRC.F9/159/2024,Maria Cristina Covașă,,,,"Admite cererea înregistrată sub numărul 22101 din data de 28.06.2024, autorizează constituirea \na CONDRUZ MIOARA PERSOANĂ FIZICĂ AUTORIZATĂ, cu următoarele date: \n \n - sediul profesional: Municipiul Brăila, Strada SIMION BĂRNUȚIU, Nr. 18, Bloc A26, Scara 1, Etaj \nPARTER, Ap. 2, Judet Brăila \n - domeniul principal de activitate: grupa CAEN: \n329 - Alte activități industriale \n - activitate principală: \n3299 - Fabricarea altor produse manufacturiere n.c.a. \n             Persoana fizică autorizată:  \n1. CONDRUZ MIOARA, cu domiciliu în Judet Brăila, Municipiul Brăila. \nDispune înregistrarea în registrul comerțului a datelor din declarația pe propria răspundere cu \nprivire la îndeplinirea condițiilor de  funcționarea/desfășurarea a activității. \nDispune publicarea prezentei încheieri în Buletinul Electronic al Registrului Comerțului. \nExecutorie \nCu drept de plângere, în termen de 10 zile, la judecătoria în a cărei rază teritorială se află sediul \nprofesional al solicitantului, în condițiile art. 112 și art. 113 din Legea nr. 265/2022 privind registrul \ncomerțului și pentru modificarea și completarea altor acte normative cu incidență asupra înregistrării în \nregistrul comerțului. \nPronunţată în data de: 01.07.2024"
17424,4387,02.07.2024,NIGHT CLUB FLAMINGO S.R.L.,"Loc. Ianca, Oraş Ianca, Strada EROILOR, Nr. 7, Bloc F5, Scara 1, Etaj 2, Ap. 4, Judet",Brăila,50299791,J9/424/2024,,Cecilia Dorobăț,,,,"Admite cererea înregistrată sub numărul 17424 din data de 21.06.2024, autorizează constituirea\na NIGHT CLUB FLAMINGO S.R.L., cu următoarele date:\n - sediul social: Loc. Ianca, Oraș Ianca, Strada EROILOR, Nr. 7, Bloc F5, Scara 1, Etaj 2, Ap. 4, Judet \nBrăila\n - domeniul principal de activitate: grupa CAEN:\n932 - Alte activități recreative și distractive\n - activitate principală:\n9329 - Alte activități recreative și distractive n.c.a.\n - capital social:100 LEI, total părți sociale: 100 a câte 1 LEI fiecare\n - fondatori:\n1. CONSTANTIN ȘTEFAN, cu domiciliu în Judet Brăila, Loc. Ianca, Oraș Ianca.\n - administrator:\n1. CONSTANTIN ȘTEFAN, cu domiciliu în Judet Brăila, Loc. Ianca, Oraș Ianca.\n - durata de funcționare: nedeterminată; \nDispune înregistrarea în registrul comerțului a datelor din declarația pe propria răspundere cu\nprivire la îndeplinirea condițiilor de  funcționarea/desfășurarea a activității.\nDispune publicarea în Monitorul Oficial al României, Partea a IV-a, a extrasului prezentei\nîncheieri.\nDispune publicarea prezentei încheieri în Buletinul Electronic al Registrului Comerțului.\nExecutorie\nCu drept de plângere, în termen de 10 zile, la Tribunalul Brăila în condițiile art. 112 și art. 113\ndin Legea nr. 265/2022 privind registrul comerțului și pentru modificarea și completarea altor acte\nnormative cu incidență asupra înregistrării în registrul comerțului.\n1\n26\nPronunţată în data de: 01.07.2024"
22091,4388,02.07.2024,NASCU PAUL TRANS S.R.L.,"Municipiul Brăila, Strada PROGRESULUI, Nr. 3, Bloc A8, Scara 3, Etaj 3, Ap. 41,",Brăila,50299805,J9/425/2024,,Cecilia Dorobăț,,,,"Admite cererea înregistrată sub numărul 22091 din data de 28.06.2024, autorizează constituirea\na NASCU PAUL TRANS S.R.L., cu următoarele date:\n - sediul social: Municipiul Brăila, Strada PROGRESULUI, Nr. 3, Bloc A8, Scara 3, Etaj 3, Ap. 41, \nJudet Brăila\n - domeniul principal de activitate: grupa CAEN:\n494 - Transporturi rutiere de mărfuri și servicii de mutare\n - activitate principală:\n4941 - Transporturi rutiere de mărfuri\n - capital social:200 LEI, integral vărsat, total părți sociale: 20 a câte 10 LEI fiecare\n - fondatori:\n1. NAȘCU PAUL, cu domiciliu în Judet Brăila, Municipiul Brăila.\n - administrator:\n1. NAȘCU PAUL, cu domiciliu în Judet Brăila, Municipiul Brăila.\n - durata de funcționare: nedeterminată; \nDispune înregistrarea în registrul comerțului a datelor din declarația pe propria răspundere cu\nprivire la îndeplinirea condițiilor de  funcționarea/desfășurarea a activității.\nDispune publicarea în Monitorul Oficial al României, Partea a IV-a, a extrasului prezentei\nîncheieri.\nDispune publicarea prezentei încheieri în Buletinul Electronic al Registrului Comerțului.\nExecutorie\nCu drept de plângere, în termen de 10 zile, la Tribunalul Brăila în condițiile art. 112 și art. 113\ndin Legea nr. 265/2022 privind registrul comerțului și pentru modificarea și completarea altor acte\nnormative cu incidență asupra înregistrării în registrul comerțului.\n1\n28\nPronunţată în data de: 01.07.2024"
