dossier_number,decision_number,pronounced_date,firm_name,address,county,registration_code,registration_order,euid,registrator,requestor,quality,request_details,disposition_text
25734/28.12.2023,6820,29.12.2023,APĂRĂȘTEI ALEXANDRU-IONUȚ PERSOANĂ FIZICĂ AUTORIZATĂ,"Sat Cişmea, Comuna Răchiţi, Nr. 2, Judet Botoşani",Botoșani,48120737,F7/250/2023,ROONRC.F7/250/2023,Gabriela Romaniuc,APĂRĂȘTEI ALEXANDRU-IONUȚ,persoana fizica autorizata  al APĂRĂȘTEI  ALEXANDRU-IONUȚ PERSOANĂ FIZICĂ AUTORIZATĂ,radierea firmei din registrul  comerțului.,"Admite cererea înregistrată sub nr. 25734 din data de 28.12.2023  având ca obiect: radiere \nfirmă. \nDispune publicarea prezentei încheieri în Buletinul Electronic al Registrului Comerţului. \n \nExecutorie. \n \nCu drept de plângere, în termen de 10 zile, la judecătoria în a cărei rază teritorială se află sediul \nprofesional al solicitantului, în condițiile art.112 și art.113 din Legea nr. 265/2022 privind registrul \ncomerțului și pentru modificarea și completarea altor acte normative cu incidență asupra înregistrării \nîn registrul comerțului. \n \nPronunțată în data de: 29.12.2023"
25730/28.12.2023,6828,29.12.2023,GUWAP SHADY 23 S.R.L.,"Municipiul Botoşani, Calea NAŢIONALĂ, Nr. 61, Scara B, Etaj 8, Ap. 31, Judet",Botoșani,39873396,J7/527/2018,ROONRC.J7/527/2018,Gabriela Romaniuc,MURARIU  MĂDĂLINA-MARILENA,administrator al  GUWAP SHADY 23 S.R.L.,"înscriere mențiuni , referitoare la  depunere act constitutiv actualizat (art.204 din Legea nr. 31/1990)   avand numarul 1307 din data: 28.12.2023, modificare date asociaţi persoane fizice; modificare date  persoane împuternicite; Dizolvare si lichidare conform art.227 alin.(1), lit.d si art.235 din Legea nr.  31/1990.","Admite cererea înregistrată sub nr. 25730 din data de 28.12.2023  având ca obiect: modificare \ndate asociaţi persoane fizice; modificare date persoane împuternicite; Dizolvare si lichidare conform \nart.227 alin.(1), lit.d si art.235 din Legea nr. 31/1990, potrivit datelor din: Hotărârea adunării generale \na asociaţilor nr. 1 din 23.08.2023; depunere act constitutiv actualizat (art.204 din Legea nr. 31/1990)  \navand numarul 1307 din data: 28.12.2023. \nDispune publicarea prezentei încheieri în Buletinul Electronic al Registrului Comerţului.\n \nDispune publicarea în Monitorul Oficial al României, Partea a IV-a, a următoarelor acte: \nHotărârea adunării generale a asociaţilor nr. 1 din 23.08.2023 şi a notificării privind depunerea la \noficiul registrului comerţului a actului constitutiv actualizat. \n \nExecutorie. \n \nCu drept de plângere, în termen de 10 zile, la Tribunalul Botoșani în condițiile art.112 și \nart.113 din Legea nr. 265/2022 privind registrul comerțului și pentru modificarea și completarea altor \nacte normative cu incidență asupra înregistrării în registrul comerțului. \n \nPronunțată în data de: 29.12.2023"
25747/28.12.2023,6818,29.12.2023,COCRIŞ VLAD ÎNTREPRINDERE INDIVIDUALĂ,"Municipiul Botoşani, Strada PRIMĂVERII, Nr. 7, Scara B, Etaj 8, Ap. 33, Judet",Botoșani,36273869,F7/317/2016,ROONRC.F7/317/2016,Gabriela Romaniuc,COCRIŞ  VLAD,titular întreprindere individuala  al COCRIŞ VLAD ÎNTREPRINDERE  INDIVIDUALĂ,radierea firmei din registrul comerțului.,"Admite cererea înregistrată sub nr. 25747 din data de 28.12.2023  având ca obiect: radiere \nfirmă. \nDispune publicarea prezentei încheieri în Buletinul Electronic al Registrului Comerţului. \n \nExecutorie. \n \nCu drept de plângere, în termen de 10 zile, la judecătoria în a cărei rază teritorială se află sediul \nprofesional al solicitantului, în condițiile art.112 și art.113 din Legea nr. 265/2022 privind registrul \ncomerțului și pentru modificarea și completarea altor acte normative cu incidență asupra înregistrării \nîn registrul comerțului. \n \nPronunțată în data de: 29.12.2023"
25741/28.12.2023,6819,29.12.2023,BELECCIU IONEL ÎNTREPRINDERE INDIVIDUALĂ,"Municipiul Botoşani, Aleea GRIVIŢA, Nr. 22, Scara A, Etaj 3, Ap. 7, Judet Botoşani",Botoșani,34052560,F7/62/2015,ROONRC.F7/62/2015,Gabriela Romaniuc,BELECCIU IONEL,titular întreprindere individuala  al BELECCIU IONEL  ÎNTREPRINDERE INDIVIDUALĂ,radierea firmei din registrul comerțului.,"Admite cererea înregistrată sub nr. 25741 din data de 28.12.2023  având ca obiect: radiere \nfirmă. \nDispune publicarea prezentei încheieri în Buletinul Electronic al Registrului Comerţului. \n \nExecutorie. \n \nCu drept de plângere, în termen de 10 zile, la judecătoria în a cărei rază teritorială se află sediul \nprofesional al solicitantului, în condițiile art.112 și art.113 din Legea nr. 265/2022 privind registrul \ncomerțului și pentru modificarea și completarea altor acte normative cu incidență asupra înregistrării \nîn registrul comerțului. \n \nPronunțată în data de: 29.12.2023"
25748/28.12.2023,6830,29.12.2023,ACTIV AUTOVIC SERVICE SRL,"Sat Cătămăreşti-Deal, Comuna Mihai Eminescu, clădire din parcela cadastrală 22/12,",Botoșani,27167788,J7/220/2010,ROONRC.J07/220/2010,Gabriela Romaniuc,SAVIN  MARIA-IULIANA,administrator al  ACTIV AUTOVIC SERVICE SRL,"înscriere mențiuni , referitoare la  transmitere părţi sociale pentru persoane fizice; depunere act  constitutiv actualizat (art.204 din Legea nr. 31/1990)  din data: 27.12.2023, adăugare, retragere  asociaţi persoane fizice; revocare, numire persoane împuternicite; durată societate.","Admite cererea înregistrată sub nr. 25748 din data de 28.12.2023  având ca obiect: transmitere \npărţi sociale pentru persoane fizice; adăugare, retragere asociaţi persoane fizice; revocare, numire \npersoane împuternicite; durată societate, potrivit datelor din: Decizie asociat unic nr. 3 din 27.12.2023; \ndepunere act constitutiv actualizat (art.204 din Legea nr. 31/1990)  din data: 27.12.2023. \nDispune publicarea prezentei încheieri în Buletinul Electronic al Registrului Comerţului.\n \nDispune publicarea în Monitorul Oficial al României, Partea a IV-a, a următoarelor acte: \nDecizie asociat unic nr. 3 din 27.12.2023 şi a notificării privind depunerea la oficiul registrului \ncomerţului a actului constitutiv actualizat. \n \nExecutorie. \n \nCu drept de plângere, în termen de 10 zile, la Tribunalul Botoșani în condițiile art.112 și \nart.113 din Legea nr. 265/2022 privind registrul comerțului și pentru modificarea și completarea altor \nacte normative cu incidență asupra înregistrării în registrul comerțului. \n \nPronunțată în data de: 29.12.2023"
25752/28.12.2023,6834,29.12.2023,FOTO MARIUS STUDIO SRL,"Municipiul Botoşani, Aleea CURCUBEULUI, Nr. 13, Scara E, Etaj 1, Ap. 4, Judet",Botoșani,38136531,J7/629/2017,ROONRC.J7/629/2017,Gabriela Romaniuc,CORDUNEANU MARIUS,administrator al  FOTO MARIUS STUDIO SRL,radierea firmei din registrul comerțului.,"Admite cererea înregistrată sub nr. 25752 din data de 28.12.2023  având ca obiect: radiere \nfirmă.  Motivul radierii este vointa profesionistului. \nDispune publicarea prezentei încheieri în Buletinul Electronic al Registrului Comerţului.  \n \nExecutorie. \n \nCu drept de plângere, în termen de 10 zile, la Tribunalul Botoșani în condițiile art.112 și \nart.113 din Legea nr. 265/2022 privind registrul comerțului și pentru modificarea și completarea altor \nacte normative cu incidență asupra înregistrării în registrul comerțului. \n \nPronunțată în data de: 29.12.2023"
25723/28.12.2023,6826,29.12.2023,AIRAHAZ SRL,"Loc. Darabani, Oraş Darabani, Str. CONSTANTIN STERE, Nr. 4, Judet Botoşani",Botoșani,17629219,J7/366/2005,ROONRC.J07/366/2005,Gabriela Romaniuc,ZAHARIA  PETRICĂ-VICTOR,administrator al  AIRAHAZ SRL,"înscriere mențiuni,  referitoare la  solicitant declaraţii şi înregistrarea datelor din declarația pe propria răspundere cu privire  la îndeplinirea condițiilor de  funcționarea/desfășurarea a activității.","Admite cererea înregistrată sub nr. 25723 din data de 28.12.2023  având ca obiect: solicitant \ndeclaraţii, înregistrarea datelor din declarația pe propria răspundere cu privire la îndeplinirea \ncondițiilor de  funcționarea/desfășurarea a activității, potrivit datelor din: Declarație pe proprie \nrăspundere cu privire la îndeplinirea condițiilor de funcționare/desfășurare a activității nr. 25723 din \n28.12.2023. \nDispune publicarea prezentei încheieri în Buletinul Electronic al Registrului Comerţului.  \n \nExecutorie. \n \nCu drept de plângere, în termen de 10 zile, la Tribunalul Botoșani în condițiile art.112 și \nart.113 din Legea nr. 265/2022 privind registrul comerțului și pentru modificarea și completarea altor \nacte normative cu incidență asupra înregistrării în registrul comerțului. \n \nPronunțată în data de: 29.12.2023"
25737/28.12.2023,6825,29.12.2023,TOMHALVET S.R.L.,"Municipiul Botoşani, Strada GĂRII, Nr. 4, Judet Botoşani",Botoșani,38794405,J7/61/2018,ROONRC.J7/61/2018,Gabriela Romaniuc,HUNEA  BIANCA-FLORENTINA,administrator al  TOMHALVET S.R.L.,"înscriere  mențiuni , referitoare la  depunere act constitutiv actualizat (art.204 din Legea nr. 31/1990)  avand  numarul 1309 din data: 28.12.2023, modificare date asociaţi persoane fizice; modificare date persoane  împuternicite; durată societate.","Admite cererea înregistrată sub nr. 25737 din data de 28.12.2023  având ca obiect: modificare \ndate asociaţi persoane fizice; modificare date persoane împuternicite; durată societate, potrivit datelor \ndin: Decizie asociat unic nr. 1 din 19.12.2023; depunere act constitutiv actualizat (art.204 din Legea \nnr. 31/1990)  avand numarul 1309 din data: 28.12.2023. \nDispune publicarea prezentei încheieri în Buletinul Electronic al Registrului Comerţului.\n \nDispune publicarea în Monitorul Oficial al României, Partea a IV-a, a următoarelor acte: \nDecizie asociat unic nr. 1 din 19.12.2023 şi a notificării privind depunerea la oficiul registrului \ncomerţului a actului constitutiv actualizat. \n \nExecutorie. \n \nCu drept de plângere, în termen de 10 zile, la Tribunalul Botoșani în condițiile art.112 și \nart.113 din Legea nr. 265/2022 privind registrul comerțului și pentru modificarea și completarea altor \nacte normative cu incidență asupra înregistrării în registrul comerțului. \n \nPronunțată în data de: 29.12.2023"
