dossier_number,decision_number,pronounced_date,firm_name,address,county,registration_code,registration_order,euid,registrator,requestor,quality,request_details,disposition_text
36126/27.12.2023,9651,28.12.2023,MILETI R.K. S.R.L.,"Sat Racoviţa, Comuna Budeşti, Strada Bâlciului, Nr. 16, biroul C1 1 4S, Judet Vâlcea",Vâlcea,48848510,,ROONRC.J38/851/2023,,,,,
36143/28.12.2023,9735,29.12.2023,RAMONA'S BEAUTY CENTER S.R.L.,"Sat Otetelişu, Oraş Bălceşti, Strada OLTEŢULUI, Nr. 45, Judet Vâlcea",Vâlcea,49263255,,ROONRC.J38/1091/2023,,POTCOVARU  RAMONA-ʒTEFANIA,administrator al  RAMONA'S BEAUTY CENTER S.R.L.,"înscriere  mențiuni , referitoare la  sedii secundare; solicitant declaraţii şi înregistrarea datelor din declarația pe propria  răspundere cu privire la îndeplinirea condițiilor de  funcționarea/desfăʓurarea a activității",
36142,9746,29.12.2023,MIRU ETAN MARKET S.R.L.,"Oraş Băile Govora, Strada STEJARULUI, Nr. 18, Judet Vâlcea",Vâlcea,49350661,,,,,,,
36211,9731,29.12.2023,VIO AUTO LKW S.R.L.,"Sat Negruleşti, Comuna Bărbăteşti, Strada Principală, Nr. 34, Judet Vâlcea",Vâlcea,49350670,,,,,,,
35941,9693,29.12.2023,SPECIAL LIFTING SOLUTIONS S.R.L.,"Sat Bârseşti, Comuna Mihăeşti, Nr. 118, Punct Acasa, Judet Vâlcea",Vâlcea,49350653,,,,,,,
36209/28.12.2023,9737,29.12.2023,99 VEHICLES MEDIA S.R.L.,"Municipiul Râmnicu Vâlcea, Strada STOLNICENI, Nr. 205A, Judet Vâlcea",Vâlcea,40586341,,ROONRC.J38/240/2019,,BĂLĂNESCU  RĂZVAN,administrator al  99 VEHICLES MEDIA S.R.L.,"înscriere mențiuni , referitoare la   cod obiect de activitate; Depunere act constitutiv actualizat (art.204 din Legea nr. 31/1990)  conform actului Act  constitutiv actualizat din data: 22.12.2023, solicitant declaraţii şi înregistrarea datelor din declarația pe propria  răspundere cu privire la îndeplinirea condițiilor de  funcționarea/desfășurarea a activității",
36216/28.12.2023,9709,29.12.2023,LEXTRANS RIDE S.R.L.,"Municipiul Râmnicu Vâlcea, Strada VASILE ALECSANDRI, Nr. 8, Clădirea C1, etaj 2, biroul nr.4,",Vâlcea,48310618,,ROONRC.J38/526/2023,,POPA ELENA-DIANA,administrator al  LEXTRANS RIDE S.R.L.,"înscriere mențiuni , referitoare la  Dizolvare si  lichidare conform art.227 alin.(1), lit.d si art.235 din Legea nr. 31/1990",
36191/28.12.2023,9708,29.12.2023,ALERGOSTOP SRL,"Municipiul Râmnicu Vâlcea, Str. LUCIAN BLAGA, Nr. 7, Bloc A.33, Scara C, Etaj 4, Ap. 9, Judet",Vâlcea,15102238,,ROONRC.J38/617/2002,,BALAN SANDA  DANIELA,administrator al  ALERGOSTOP SRL,"înscriere mențiuni , referitoare la  modificare  date asociaţi persoane fizice; modificare date persoane împuternicite; modificare stare firmă; Dizolvare si  lichidare conform art.227 alin.(1), lit.d si art.235 din Legea nr. 31/1990",
36198/28.12.2023,9691,29.12.2023,CRISBO-TRANS SRL,"Oraş Bălceşti, Strada TUDOR VLADIMIRESCU, Nr. 107, Judet Vâlcea",Vâlcea,4478521,,ROONRC.J38/797/1993,,SANDU BOGDAN-ILIE,administrator al  CRISBO-TRANS SRL,"înscriere mențiuni , referitoare la  sedii secundare",
36202/28.12.2023,9724,29.12.2023,ECOSMART DIVERS S.R.L.,"Municipiul Drăgă`ani, Strada BEL_UGULUI, Nr. 108, Judet Vâlcea",Vâlcea,35955035,,ROONRC.J38/334/2016,,ANCUcA DUMITRU- BOGDAN,administrator al  ECOSMART DIVERS S.R.L.,radierea firmei din registrul  comerțului,
36185/28.12.2023,9716,29.12.2023,ANAMAROM SRL,"Municipiul Râmnicu Vâlcea, Str. Emil Avramescu, Nr. 5, Bloc R, Scara A, Ap. 20, Judet Vâlcea",Vâlcea,17181890,,ROONRC.J38/110/2005,,CRETOIU BOGDAN  CONSTANTIN,administrator al  ANAMAROM SRL,"înscriere mențiuni , referitoare la   modificare date asociaţi persoane fizice; modificare date persoane împuternicite; modificare stare firmă; Dizolvare  si lichidare conform art.227 alin.(1), lit.d si art.235 din Legea nr. 31/1990",
36177/28.12.2023,9745,29.12.2023,AVI-GIIS SRL,"Sat Stupărei, Comuna Mihăeşti, Com. Mihaesti, Judet Vâlcea",Vâlcea,2553570,,ROONRC.J38/1090/1991,,GEORGESCU ION în  calitate de administrator al  AVI-GIIS SRL,,"înscriere mențiuni , referitoare la  transmitere părţi sociale  pentru persoane fizice; Depunere act constitutiv actualizat (art.204 din Legea nr. 31/1990)  conform actului Act  constitutiv actualizat  avand numarul 36177 din data: 28.12.2023, retragere, adăugare asociaţi persoane fizice;  modificare durată mandat persoane împuternicite",
36197/28.12.2023,9742,29.12.2023,HDC S.R.L.,"Municipiul Râmnicu Vâlcea, Strada GORANU, Nr. 13A, Judet Vâlcea",Vâlcea,37791966,,ROONRC.J38/650/2017,,SMĂRĂNDESCU  DUMITRU-DANIEL,administrator al  HDC S.R.L.,"înscriere mențiuni , referitoare la   transmitere părţi sociale pentru persoane fizice; Depunere act constitutiv actualizat (art.204 din Legea nr.  31/1990)  conform actului Act constitutiv actualizat  avand numarul 36197 din data: 28.12.2023, adăugare,  modificare date asociaţi persoane fizice; modificare date persoane împuternicite",
36145/28.12.2023,9712,29.12.2023,RAUL CEREAL S.R.L.,"Sat Racoviţa, Comuna Budeşti, Strada Bâlciului, Nr. 16, biroul C1 1 3 DA., Judet Vâlcea",Vâlcea,40949293,,ROONRC.J38/540/2019,,CERCHEZ ELGIN în  calitate de administrator al  RAUL CEREAL S.R.L.,,"înscriere mențiuni , referitoare la  prelungire valabilitate  acte sediu social",
36175/28.12.2023,9744,29.12.2023,VILFOREST SRL,"Sat Olteni, Comuna Bujoreni, Com. Bujoreni, Judet Vâlcea",Vâlcea,12617485,,ROONRC.J38/405/1999,,GEORGESCU ION în  calitate de administrator al  VILFOREST SRL,,"înscriere mențiuni , referitoare la  transmitere părţi sociale  pentru persoane fizice; Depunere act constitutiv actualizat (art.204 din Legea nr. 31/1990)  conform actului Act  constitutiv actualizat din data: 27.12.2023, retragere, adăugare, modificare date asociaţi persoane fizice;  modificare date, modificare durată mandat persoane împuternicite; durată societate",
36199/28.12.2023,9722,29.12.2023,MELYSSA CAFFE S.R.L.,"Municipiul Râmnicu Vâlcea, Strada FÂNTÂNII, Nr. 21, Judet Vâlcea",Vâlcea,34764835,,ROONRC.J38/397/2015,,URECHE SILVIU-ION,administrator al  MELYSSA CAFFE S.R.L.,radierea firmei din registrul comerțului,
36164/28.12.2023,9739,29.12.2023,DEEP FOREST FEST S.R.L.,"Municipiul Râmnicu Vâlcea, Strada GENERAL MAGHERU, Nr. 23, Judet Vâlcea",Vâlcea,40188656,,ROONRC.J38/1013/2018,,TOMA NICOLAE- CRISTIAN,administrator al  DEEP FOREST FEST S.R.L.,"înscriere mențiuni , referitoare la   capital social; participare străină la capital; tip capital; transmitere părţi sociale pentru persoane fizice; Depunere  act constitutiv actualizat (art.204 din Legea nr. 31/1990)  conform actului Act constitutiv actualizat din data:  22.12.2023, adăugare, modificare date asociaţi persoane fizice; modificare date persoane împuternicite",
36181/28.12.2023,9715,29.12.2023,ROMSTAR SRL,"Municipiul Râmnicu Vâlcea, Str. STIRBEI VODA, Nr. 7, Bloc P.1, Scara D, Ap. 5, Judet Vâlcea",Vâlcea,3290650,,ROONRC.J38/122/1993,,NEGOESCU FLORIN  VALENTIN,asociat al  ROMSTAR SRL,"înscriere mențiuni , referitoare la  modificare date  asociaţi persoane fizice; modificare date persoane împuternicite; modificare stare firmă; Dizolvare si lichidare  conform art.227 alin.(1), lit.d si art.235 din Legea nr. 31/1990",
36222/28.12.2023,9736,29.12.2023,MARKET MAKER SRL-D,"Sat Malu Vârtop, Comuna Bujoreni, Nr. 154 bis , Judet Vâlcea",Vâlcea,33639788,,ROONRC.J38/531/2014,,MANIA DORU-MIHAIL,administrator al  MARKET MAKER SRL-D,"înscriere mențiuni , referitoare la  schimbare  denumire firmă; Depunere act constitutiv actualizat (art.204 din Legea nr. 31/1990)  conform actului Act constitutiv  actualizat  avand numarul 2783 din data: 28.12.2023, modificare date asociaţi persoane fizice; modificare date  persoane împuternicite; formă juridică; modificare stare firmă şi înregistrarea datelor din declarația pe propria  răspundere cu privire la îndeplinirea condițiilor de  funcționarea/desfășurarea a activității",
36160/28.12.2023,9718,29.12.2023,MAIUKI S.R.L.,"Oraş Băile Olăneşti, Strada 1 MAI, Nr. 2, Judet Vâlcea",Vâlcea,42246800,,ROONRC.J38/154/2020,,NECIU IULIAN  VERGILIU,administrator al  MAIUKI S.R.L.,radierea firmei din registrul comerțului,
36167/28.12.2023,9707,29.12.2023,DONELIF SRL,"Municipiul Râmnicu Vâlcea, B-dul TINERETULUI, Bloc B.5, Scara D, Etaj P, Judet Vâlcea",Vâlcea,9535075,,ROONRC.J38/333/1997,,GOGOAŞE FLORIAN,administrator al  DONELIF SRL,"înscriere mențiuni , referitoare la  prelungire valabilitate acte  sediu social",
36195/28.12.2023,9743,29.12.2023,MAGNA VISION S.R.L.,"Municipiul Râmnicu Vâlcea, Strada GORANU, Nr. 13A, Judet Vâlcea",Vâlcea,35314936,,ROONRC.J38/728/2015,,SMĂRĂNDESCU  DUMITRU-DANIEL,administrator al  MAGNA VISION S.R.L.,"înscriere mențiuni , referitoare  la  transmitere părţi sociale pentru persoane fizice; Depunere act constitutiv actualizat (art.204 din Legea nr.  31/1990)  conform actului Act constitutiv actualizat  avand numarul 2779 din data: 28.12.2023, adăugare,  modificare date asociaţi persoane fizice; modificare date persoane împuternicite",
36213/28.12.2023,9750,29.12.2023,JPM CONSTRUCT SRL,"Sat Costeşti, Comuna Costeşti, Strada Trovanţilor, Nr. 118, Judet Vâlcea",Vâlcea,27761194,,ROONRC.J38/430/2010,,STĂNCĂLIA ION în  calitate de administrator al  JPM CONSTRUCT SRL,,"înscriere mențiuni , referitoare la  sedii secundare;  solicitant declaraţii şi înregistrarea datelor din declarația pe propria răspundere cu privire la îndeplinirea condițiilor  de  funcționarea/desfășurarea a activității",
36170/28.12.2023,9714,29.12.2023,ANION BETON S.R.L.,"Sat Prodăneşti, Comuna Ioneşti, Nr. 8, Judet Vâlcea",Vâlcea,36081022,,ROONRC.J38/401/2016,,NEGOESCU SANDA- CRISTIANA,mandatar al  ANION BETON S.R.L.,"înscriere mențiuni , referitoare la  Dizolvare  si lichidare conform art.227 alin.(1), lit.d si art.235 din Legea nr. 31/1990",
36161/28.12.2023,9733,29.12.2023,CURIER  SRL,"Municipiul Râmnicu Vâlcea, Strada CAROL I, Nr. 1, 1A, Judet Vâlcea",Vâlcea,1467340,,ROONRC.J38/229/1991,,BARBU SORIN- ALEXANDRU,administrator al  CURIER  SRL,"înscriere mențiuni , referitoare la  Depunere  act constitutiv actualizat (art.204 din Legea nr. 31/1990)  conform actului Act constitutiv actualizat din data:  28.12.2023, modificare date asociaţi persoane fizice",
36182/28.12.2023,9711,29.12.2023,NUCOR S.R.L.,"Municipiul Râmnicu Vâlcea, Strada MATEI BASARAB, Nr. 4B, camera 4, Judet Vâlcea",Vâlcea,31587747,,ROONRC.J38/260/2013,,GROZA ION în calitate  de administrator al  NUCOR S.R.L.,,"înscriere mențiuni , referitoare la  Numire expert pentru evaluare  aporturi în natură  conform actului Cerere numire expert  avand numarul 367 din data: 20.12.2023",
36233/28.12.2023,9721,29.12.2023,BIST SPORT S.R.L.,"Sat Racoviţa, Comuna Budeşti, Strada Bâlciului, Nr. 16, birou C1 P 5D, Judet Vâlcea",Vâlcea,42614570,,ROONRC.J38/390/2020,,ŞTEFĂNESCU  CIPRIAN-GHEORGHE,administrator al  BIST SPORT S.R.L.,"înscriere mențiuni , referitoare  la  prelungire valabilitate acte sediu social",
36218/28.12.2023,9688,29.12.2023,GOIA RITUAL CENTER S.R.L.,"Municipiul Râmnicu Vâlcea, Strada VASILE ALECSANDRI, Nr. 8, Clădirea C1, et. 1, Judet Vâlcea",Vâlcea,40320020,,ROONRC.J38/1120/2018,,POPA OVIDIU în  calitate de administrator al  GOIA RITUAL CENTER S.R.L.,,"înscriere mențiuni , referitoare la  transmitere  părţi sociale pentru persoane fizice; Depunere act constitutiv actualizat (art.204 din Legea nr. 31/1990)  conform  actului Act constitutiv actualizat din data: 28.12.2023, retragere, adăugare asociaţi persoane fizice; numire,  revocare persoane împuternicite",
36217/28.12.2023,9727,29.12.2023,INTELLIGENT TRAFFIC AUDIT S.R.L.,"Municipiul Râmnicu Vâlcea, Strada STRAUBING, Nr. 108, Judet Vâlcea",Vâlcea,45884179,,ROONRC.J38/319/2022,,POPA OVIDIU în  calitate de administrator al  INTELLIGENT TRAFFIC AUDIT S.R.L.,,"înscriere mențiuni , referitoare la   Dizolvare si lichidare conform art.227 alin.(1), lit.d si art.235 din Legea nr. 31/1990",
36205/28.12.2023,9732,29.12.2023,ROCINEMA S.R.L.,"Oraş Băile Olăneşti, Strada MIHAIL EMINESCU, nr. lot 3, Judet Vâlcea",Vâlcea,30881751,,ROONRC.J38/572/2012,,MARDALE SILVIU- AURELIAN,administrator al  ROCINEMA S.R.L.,"înscriere mențiuni , referitoare la   transmitere părţi sociale pentru persoane fizice; sedii secundare; Depunere act constitutiv actualizat (art.204 din  Legea nr. 31/1990)  conform actului Act constitutiv actualizat din data: 28.12.2023, modificare date, retragere  asociaţi persoane fizice",
36165/28.12.2023,9734,29.12.2023,PRAXIS SRL,"Loc. Horezu, Oraş Horezu, Strada TUDOR VLADIMIRESCU, Nr. 124A, Judet Vâlcea",Vâlcea,8665220,,ROONRC.J38/455/1996,,VLĂDĂ_EL BIANCA- MARIA,administrator al  PRAXIS SRL,"înscriere mențiuni , referitoare la  transmitere părţi  sociale pentru persoane fizice; Depunere act constitutiv actualizat (art.204 din Legea nr. 31/1990)  conform  actului Act constitutiv actualizat din data: 27.12.2023, modificare date, retragere asociaţi persoane fizice",
36207/28.12.2023,9689,29.12.2023,CONCED VÂLCEA S.R.L.,"Oraş Băile Govora, Strada FAGULUI, Nr. 6, Judet Vâlcea",Vâlcea,46872156,,ROONRC.J38/1097/2022,,PĂUNESCU ELENA în  calitate de administrator al  CONCED VÂLCEA S.R.L.,,"înscriere mențiuni , referitoare la  transmitere părţi  sociale pentru persoane fizice; Depunere act constitutiv actualizat (art.204 din Legea nr. 31/1990)  conform  actului Act constitutiv actualizat din data: 28.12.2023, retragere, adăugare asociaţi persoane fizice; revocare,  numire persoane împuternicite",
36146/28.12.2023,9738,29.12.2023,SENIVIL EXPERT CONSULTING S.R.L.,"Municipiul Râmnicu Vâlcea, Strada REGINA MARIA, Nr. 21, Bloc C12, Scara E, Etaj 4, Ap. 10, Judet",Vâlcea,35280906,,ROONRC.J38/713/2015,,VÎLCULESCU  SENINA-CAMELIA,administrator al  SENIVIL EXPERT CONSULTING S.R.L.,"înscriere  mențiuni , referitoare la  sedii secundare; solicitant declaraţii şi înregistrarea datelor din declarația pe propria  răspundere cu privire la îndeplinirea condițiilor de  funcționarea/desfășurarea a activității",
