dossier_number,decision_number,pronounced_date,firm_name,address,county,registration_code,registration_order,euid,registrator,requestor,quality,request_details,disposition_text
348/09.01.2024,499,26.01.2024,PELICAN TRAVEL SRL,"Sat Maliuc, Comuna Maliuc, Aleea IRIS, Nr. 1, CAMERA 2, Bloc 1, Scara B, Etaj 1, Ap.",Tulcea,34422913,J36/161/2015,ROONRC.J36/161/2015,Geta Voinea,STAVARACHE IONUŢ-FLORENTIN,asociat unic al  PELICAN TRAVEL SRL,"înscriere mențiuni , referitoare la  cod obiect de activitate; sedii secundare; Depunere act  constitutiv actualizat (art.204 din Legea nr. 31/1990)  conform actului Act constitutiv actualizat din  data: 08.01.2024, revocare, numire persoane împuternicite; solicitant declaraţii şi înregistrarea datelor  din declarația pe propria răspundere cu privire la îndeplinirea condițiilor de  funcționarea/desfășurarea  a activității","Admite cererea înregistrată sub nr. 348 din data de 09.01.2024  având ca obiect: cod obiect de \nactivitate; sedii secundare; Depunere act constitutiv actualizat (art.204 din Legea nr. 31/1990)  \nconform actului Act constitutiv actualizat din data: 08.01.2024, revocare, numire persoane \nîmputernicite; solicitant declaraţii, înregistrarea datelor din declarația pe propria răspundere cu privire \nla îndeplinirea condițiilor de  funcționarea/desfășurarea a activității, potrivit datelor din: Declarație pe \nproprie răspundere cu privire la îndeplinirea condițiilor de funcționare/desfășurare a activității nr. 348 \ndin 09.01.2024; Decizie asociat unic nr. 3 din 08.01.2024; depunerea actului constitutiv actualizat . \nDispune publicarea prezentei încheieri în Buletinul Electronic al Registrului Comerţului.\n \nDispune publicarea în Monitorul Oficial al României, Partea a IV-a, a următoarelor acte: \nDecizie asociat unic nr. 3 din 08.01.2024 şi a notificării privind depunerea la oficiul registrului \ncomerţului a actului constitutiv actualizat. \n \nExecutorie. \n \nCu drept de plângere, în termen de 10 zile, la Tribunalul Tulcea în condițiile art.112 și art.113 \ndin Legea nr. 265/2022 privind registrul comerțului și pentru modificarea și completarea altor acte \nnormative cu incidență asupra înregistrării în registrul comerțului. \n \nPronunțată în data de: 25.01.2024"
959/18.01.2024,493,26.01.2024,AGRIGOD MIHAIL KOGĂLNICEANU COOPERATIVĂ AGRICOLĂ,"Sat Mihail Kogălniceanu, Comuna Mihail Kogălniceanu, Strada GEORGE BACOVIA,",Tulcea,45313814,C36/39/2021,ROONRC.C36/39/2021,Geta Voinea,GODEA  NICOLAE,presedinte consiliu de administratie al  AGRIGOD MIHAIL  KOGĂLNICEANU COOPERATIVĂ AGRICOLĂ,"înscriere mențiuni , referitoare la   transmitere părţi sociale pentru persoane juridice; modificare date, adăugare asociaţi persoane juridice","Admite cererea înregistrată sub nr. 959 din data de 18.01.2024  având ca obiect: transmitere \npărţi sociale pentru persoane juridice; modificare date, adăugare asociaţi persoane juridice, potrivit \ndatelor din: Hotărârea adunării generale extraordinare a membrilor cooperatori nr. 2 din 16.01.2024 . \nDispune publicarea prezentei încheieri în Buletinul Electronic al Registrului Comerţului.  \n \nExecutorie. \n \nCu drept de plângere, în termen de 10 zile, la Tribunalul Tulcea în condițiile art.112 și art.113 \ndin Legea nr. 265/2022 privind registrul comerțului și pentru modificarea și completarea altor acte \nnormative cu incidență asupra înregistrării în registrul comerțului. \n \nPronunțată în data de: 25.01.2024"
1043,498,26.01.2024,BĂLAN D. VALERIU PERSOANĂ FIZICĂ AUTORIZATĂ,"Municipiul Tulcea, Aleea STEJARULUI, Nr. 2, Bloc U6, Scara D, Etaj 4, Ap. 20, Judet",Tulcea,49474856,F36/20/2024,ROONRC.F36/20/2024,Geta Voinea,,,,"Admite cererea înregistrată sub numărul 1043 din data de 19.01.2024, autorizează constituirea \na BĂLAN D. VALERIU PERSOANĂ FIZICĂ AUTORIZATĂ, cu următoarele date: \n \n - sediul profesional: Municipiul Tulcea, Aleea STEJARULUI, Nr. 2, Bloc U6, Scara D, Etaj 4, Ap. \n20, Judet Tulcea \n - domeniul principal de activitate: grupa CAEN: \n711 - Activităţi de arhitectură, inginerie şi servicii de consultanţă tehnică legate de acestea \n - activitate principală: \n7112 - Activităţi de inginerie şi consultanţă tehnică legate de acestea \n             Persoana fizică autorizată:  \n1. BĂLAN VALERIU, cu domiciliu în Judet Tulcea, Municipiul Tulcea. \nDispune înregistrarea în registrul comerțului a datelor din declarația pe propria răspundere cu \nprivire la îndeplinirea condițiilor de  funcționarea/desfășurarea a activității. \nDispune publicarea prezentei încheieri în Buletinul Electronic al Registrului Comerțului. \nExecutorie \nCu drept de plângere, în termen de 10 zile, la judecătoria în a cărei rază teritorială se află sediul \nprofesional al solicitantului, în condițiile art. 112 și art. 113 din Legea nr. 265/2022 privind registrul \ncomerțului și pentru modificarea și completarea altor acte normative cu incidență asupra înregistrării \nîn registrul comerțului. \nPronunţată în data de: 25.01.2024"
1288/23.01.2024,503,26.01.2024,JUMP AUTO NOW S.R.L.,"Municipiul Tulcea, Strada SLT. GAVRILOV CORNELIU, Nr. 143, Judet Tulcea",Tulcea,46665851,J36/505/2022,ROONRC.J36/505/2022,Geta Voinea,BALABAN NICOLAE-CIPRIAN,administrator al  JUMP AUTO NOW S.R.L.,"înscriere mențiuni , referitoare la  Dizolvare si lichidare conform art.227 alin.(1), lit.d si art.235 din  Legea nr. 31/1990","Admite cererea înregistrată sub nr. 1288 din data de 23.01.2024  având ca obiect: Dizolvare si \nlichidare conform art.227 alin.(1), lit.d si art.235 din Legea nr. 31/1990, potrivit datelor din: Decizie \nasociat unic nr. 1 din 23.01.2024 . \nDispune publicarea prezentei încheieri în Buletinul Electronic al Registrului Comerţului.\n \nDispune publicarea în Monitorul Oficial al României, Partea a IV-a, a următoarelor acte: \nDecizie asociat unic nr. 1 din 23.01.2024. \n \nExecutorie. \n \nCu drept de plângere, în termen de 10 zile, la Tribunalul Tulcea în condițiile art.112 și art.113 \ndin Legea nr. 265/2022 privind registrul comerțului și pentru modificarea și completarea altor acte \nnormative cu incidență asupra înregistrării în registrul comerțului. \n \nPronunțată în data de: 25.01.2024"
1275/23.01.2024,507,26.01.2024,BOOMERANG DELTA S.R.L.,"Municipiul Tulcea, Strada MIRCEA VODĂ, Nr. 13, Bloc 34, Scara B, Ap. 5, Judet",Tulcea,40986216,J36/293/2019,ROONRC.J36/293/2019,Geta Voinea,VISTERINEANU BOGDAN-IOAN,administrator al  BOOMERANG DELTA S.R.L.,"înscriere mențiuni , referitoare la  modificare date sediu social; cod obiect de activitate; text  obiect de activitate; Depunere act constitutiv actualizat (art.204 din Legea nr. 31/1990)  conform  actului Act constitutiv actualizat din data: 19.01.2024, modificare date persoane împuternicite;  solicitant declaraţii şi înregistrarea datelor din declarația pe propria răspundere cu privire la  îndeplinirea condițiilor de  funcționarea/desfășurarea a activității","Admite cererea înregistrată sub nr. 1275 din data de 23.01.2024  având ca obiect: modificare \ndate sediu social; cod obiect de activitate; text obiect de activitate; Depunere act constitutiv actualizat \n(art.204 din Legea nr. 31/1990)  conform actului Act constitutiv actualizat din data: 19.01.2024, \nmodificare date persoane împuternicite; solicitant declaraţii, înregistrarea datelor din declarația pe \npropria răspundere cu privire la îndeplinirea condițiilor de  funcționarea/desfășurarea a activității, \npotrivit datelor din: Declarație pe proprie răspundere cu privire la îndeplinirea condițiilor de \nfuncționare/desfășurare a activității nr. 1275 din 23.01.2024; Hotărâre asociat unic nr. 1 din \n19.01.2024; depunerea actului constitutiv actualizat . \nDispune publicarea prezentei încheieri în Buletinul Electronic al Registrului Comerţului.\n \nDispune publicarea în Monitorul Oficial al României, Partea a IV-a, a următoarelor acte: \nHotărâre asociat unic nr. 1 din 19.01.2024 şi a notificării privind depunerea la oficiul registrului \ncomerţului a actului constitutiv actualizat. \n \nExecutorie. \n \nCu drept de plângere, în termen de 10 zile, la Tribunalul Tulcea în condițiile art.112 și art.113 \ndin Legea nr. 265/2022 privind registrul comerțului și pentru modificarea și completarea altor acte \nnormative cu incidență asupra înregistrării în registrul comerțului. \n \nPronunțată în data de: 25.01.2024"
1002/18.01.2024,526,26.01.2024,IKARIA STAR SRL,"Sat Visterna, Comuna Sarichioi, registrul agricol poz.23, nr.15, vol.1  , cam.1, Judet",Tulcea,29049240,J36/409/2011,ROONRC.J36/409/2011,Geta Voinea,AVRAM  LILIANA-GABRIELA,administrator al  IKARIA STAR SRL,"înscriere mențiuni  , referitoare la  cod obiect de activitate; text obiect de activitate; sedii secundare; Depunere act  constitutiv actualizat (art.204 din Legea nr. 31/1990)  conform actului Act constitutiv actualizat din  data: 08.01.2024, modificare date asociaţi persoane fizice; solicitant declaraţii şi înregistrarea datelor  din declarația pe propria răspundere cu privire la îndeplinirea condițiilor de  funcționarea/desfășurarea  a activității","Admite cererea înregistrată sub nr. 1002 din data de 18.01.2024  având ca obiect: cod obiect de \nactivitate; text obiect de activitate; sedii secundare; Depunere act constitutiv actualizat (art.204 din \nLegea nr. 31/1990)  conform actului Act constitutiv actualizat din data: 08.01.2024, modificare date \nasociaţi persoane fizice; solicitant declaraţii, înregistrarea datelor din declarația pe propria răspundere \ncu privire la îndeplinirea condițiilor de  funcționarea/desfășurarea a activității, potrivit datelor din: \nDeclarație pe proprie răspundere cu privire la îndeplinirea condițiilor de funcționare/desfășurare a \nactivității nr. 1002 din 18.01.2024; Hotărârea adunării generale a asociaţilor nr. 2 din 08.01.2024; \ndepunerea actului constitutiv actualizat . \nDispune publicarea prezentei încheieri în Buletinul Electronic al Registrului Comerţului.\n \nDispune publicarea în Monitorul Oficial al României, Partea a IV-a, a următoarelor acte: \nHotărârea adunării generale a asociaţilor nr. 2 din 08.01.2024 şi a notificării privind depunerea la \noficiul registrului comerţului a actului constitutiv actualizat. \n \nExecutorie. \n \nCu drept de plângere, în termen de 10 zile, la Tribunalul Tulcea în condițiile art.112 și art.113 \ndin Legea nr. 265/2022 privind registrul comerțului și pentru modificarea și completarea altor acte \nnormative cu incidență asupra înregistrării în registrul comerțului. \n \nPronunțată în data de: 25.01.2024"
1229/23.01.2024,538,26.01.2024,TAXIGAN SRL,"Municipiul Tulcea, Intrarea CĂRPINIŢEI, Nr. 2Bis, camera 10, Judet Tulcea",Tulcea,16153892,J36/46/2004,ROONRC.J36/46/2004,Geta Voinea,TROFIM  DANIEL,administrator al  TAXIGAN SRL,"înscriere mențiuni , referitoare la   transmitere părţi sociale pentru persoane fizice; cod obiect de activitate; text obiect de activitate;  Depunere act constitutiv actualizat (art.204 din Legea nr. 31/1990)  conform actului Act constitutiv  actualizat din data: 04.01.2024, retragere, adăugare asociaţi persoane fizice; revocare, numire persoane  împuternicite","Admite cererea înregistrată sub nr. 1229 din data de 23.01.2024  având ca obiect: transmitere \npărţi sociale pentru persoane fizice; cod obiect de activitate; text obiect de activitate; Depunere act \nconstitutiv actualizat (art.204 din Legea nr. 31/1990)  conform actului Act constitutiv actualizat din \ndata: 04.01.2024, retragere, adăugare asociaţi persoane fizice; revocare, numire persoane \nîmputernicite, potrivit datelor din: Hotărâre nr. 2 din 04.01.2024; depunerea actului constitutiv \nactualizat . \nDispune publicarea prezentei încheieri în Buletinul Electronic al Registrului Comerţului.\n \nDispune publicarea în Monitorul Oficial al României, Partea a IV-a, a următoarelor acte: \nHotărâre nr. 2 din 04.01.2024 şi a notificării privind depunerea la oficiul registrului comerţului a \nactului constitutiv actualizat. \n \nExecutorie. \n \nCu drept de plângere, în termen de 10 zile, la Tribunalul Tulcea în condițiile art.112 și art.113 \ndin Legea nr. 265/2022 privind registrul comerțului și pentru modificarea și completarea altor acte \nnormative cu incidență asupra înregistrării în registrul comerțului. \n \nPronunțată în data de: 25.01.2024"
1272/23.01.2024,500,26.01.2024,REAL GUST SRL,"Municipiul Tulcea, Strada PODGORIILOR, Nr. 79 C, spatiu comercial nr.1, Judet",Tulcea,37267261,J36/144/2017,ROONRC.J36/144/2017,Geta Voinea,GURIŢĂ  ANDREI,administrator al  REAL GUST SRL,"înscriere mențiuni , referitoare la   modificare dovada sediu social; sedii secundare","Admite cererea înregistrată sub nr. 1272 din data de 23.01.2024  având ca obiect: modificare \ndovada sediu social; sedii secundare, potrivit datelor din: Contract de comodat din 01.01.2024; \nContract de comodat din 01.01.2024 . \nDispune publicarea prezentei încheieri în Buletinul Electronic al Registrului Comerţului.  \n \nExecutorie. \n \nCu drept de plângere, în termen de 10 zile, la Tribunalul Tulcea în condițiile art.112 și art.113 \ndin Legea nr. 265/2022 privind registrul comerțului și pentru modificarea și completarea altor acte \nnormative cu incidență asupra înregistrării în registrul comerțului. \n \nPronunțată în data de: 25.01.2024"
1303/23.01.2024,539,26.01.2024,ASUL GALAXY SRL,"Municipiul Tulcea, Intrarea CĂRPINIŢEI, Nr. 2 BIS, camera 4, Etaj parter, Judet",Tulcea,38097351,J36/636/2017,ROONRC.J36/636/2017,Geta Voinea,TROFIM  DANIEL,administrator al  ASUL GALAXY SRL,"înscriere mențiuni , referitoare  la  transmitere părţi sociale pentru persoane fizice; Depunere act constitutiv actualizat (art.204 din  Legea nr. 31/1990)  conform actului Act constitutiv actualizat din data: 05.01.2024, adăugare,  retragere asociaţi persoane fizice; revocare, numire persoane împuternicite","Admite cererea înregistrată sub nr. 1303 din data de 23.01.2024  având ca obiect: transmitere \npărţi sociale pentru persoane fizice; Depunere act constitutiv actualizat (art.204 din Legea nr. 31/1990)  \nconform actului Act constitutiv actualizat din data: 05.01.2024, adăugare, retragere asociaţi persoane \nfizice; revocare, numire persoane împuternicite, potrivit datelor din: Hotărârea adunării generale a \nasociaţilor nr. 2 din 05.01.2024; depunerea actului constitutiv actualizat . \nDispune publicarea prezentei încheieri în Buletinul Electronic al Registrului Comerţului.\n \nDispune publicarea în Monitorul Oficial al României, Partea a IV-a, a următoarelor acte: \nHotărârea adunării generale a asociaţilor nr. 2 din 05.01.2024 şi a notificării privind depunerea la \noficiul registrului comerţului a actului constitutiv actualizat. \n \nExecutorie. \n \nCu drept de plângere, în termen de 10 zile, la Tribunalul Tulcea în condițiile art.112 și art.113 \ndin Legea nr. 265/2022 privind registrul comerțului și pentru modificarea și completarea altor acte \nnormative cu incidență asupra înregistrării în registrul comerțului. \n \nPronunțată în data de: 25.01.2024"
255/08.01.2024,490,26.01.2024,STĂNEAȚĂ VALENTIN PERSOANĂ FIZICĂ AUTORIZATĂ,"Municipiul Tulcea, Strada CRIŞAN, Nr. 13A, Judet Tulcea",Tulcea,30816419,F36/763/2012,ROONRC.F36/763/2012,Geta Voinea,STĂNEAȚĂ VALENTIN,persoana fizica autorizata  al STĂNEAȚĂ VALENTIN  PERSOANĂ FIZICĂ AUTORIZATĂ,"înscriere mențiuni, referitoare la  modificare date  asociaţi persoane fizice; suspendare activitate firma de la 08.01.2024 până la 08.01.2027; solicitant  declaraţii şi înregistrarea datelor din declarația pe propria răspundere cu privire la îndeplinirea  condițiilor de  funcționarea/desfășurarea a activității.","Respinge cererea înregistrată sub nr. 255 din data de 08.01.2024  având ca obiect: modificare \ndate asociaţi persoane fizice; suspendare activitate firma de la 08.01.2024 până la 08.01.2027; \nsolicitant declaraţiiînregistrarea datelor din declarația pe propria răspundere cu privire la îndeplinirea \ncondițiilor de  funcționarea/desfășurarea a activității, potrivit datelor din: Declarație pe proprie \nrăspundere cu privire la îndeplinirea condițiilor de funcționare/desfășurare a activității nr. 255 din \n08.01.2024. \nDispune publicarea prezentei încheieri în Buletinul Electronic al Registrului Comerţului. \n \nExecutorie. \n \nCu drept de plângere, în termen de 10 zile, la judecătoria în a cărei rază teritorială se află sediul \nprofesional a solicitantului, în condițiile art.112 și art.113 din Legea nr. 265/2022 privind registrul \ncomerțului și pentru modificarea și completarea altor acte normative cu incidență asupra înregistrării \nîn registrul comerțului. \n \nPronunțată în data de: 25.01.2024"
942/18.01.2024,497,26.01.2024,CALMMONDIAL-NOUA VIZIUNE IN SĂNĂTATE SRL,"Municipiul Tulcea, Strada ISACCEI, Nr. 24, spatiu 22, Etaj 2, Judet Tulcea",Tulcea,36546071,J36/461/2016,ROONRC.J36/461/2016,Geta Voinea,PANAIT  CONSTANTIN,administrator al  CALMMONDIAL-NOUA VIZIUNE IN SĂNĂTATE  SRL,"înscriere mențiuni, referitoare la modificare date sediu social; Depunere act constitutiv  actualizat (art.204 din Legea nr. 31/1990)  conform actului Act constitutiv actualizat din data:  23.01.2024, modificare date asociaţi persoane fizice; modificare date persoane împuternicite; solicitant  declaraţii şi înregistrarea datelor din declarația pe propria răspundere cu privire la îndeplinirea  condițiilor de  funcționarea/desfășurarea a activității.","Respinge cererea înregistrată sub nr. 942 din data de 18.01.2024  având ca obiect: modificare \ndate sediu social; Depunere act constitutiv actualizat (art.204 din Legea nr. 31/1990)  conform actului \nAct constitutiv actualizat din data: 23.01.2024, modificare date asociaţi persoane fizice; modificare \ndate persoane împuternicite; solicitant declaraţii înregistrarea datelor din declarația pe propria \nrăspundere cu privire la îndeplinirea condițiilor de  funcționarea/desfășurarea a activității, potrivit \ndatelor din: Declarație pe proprie răspundere cu privire la îndeplinirea condițiilor de \nfuncționare/desfășurare a activității nr. 942 din 18.01.2024; Decizie asociat unic din 23.01.2024; \ndepunerea actului constitutiv actualizat. \nDispune publicarea prezentei încheieri în Buletinul Electronic al Registrului Comerţului. \n \nExecutorie. \n \nCu drept de plângere, în termen de 10 zile, la Tribunalul Tulcea în condițiile art.112 și art.113 \ndin Legea nr. 265/2022 privind registrul comerțului și pentru modificarea și completarea altor acte \nnormative cu incidență asupra înregistrării în registrul comerțului. \n \nPronunțată în data de: 25.01.2024"
1262/23.01.2024,509,26.01.2024,PRINTRE STELE S.R.L.,"Sat Cerna, Comuna Cerna, Strada TRAIAN, Nr. 8, Judet Tulcea",Tulcea,44740280,J36/500/2021,ROONRC.J36/500/2021,Geta Voinea,MOCAMOL MIHAELA,administrator al  PRINTRE STELE S.R.L.,"înscriere  mențiuni , referitoare la  modificare date sediu social; Depunere act constitutiv actualizat (art.204 din  Legea nr. 31/1990)  conform actului Act constitutiv actualizat din data: 19.01.2024, solicitant  declaraţii şi înregistrarea datelor din declarația pe propria răspundere cu privire la îndeplinirea  condițiilor de  funcționarea/desfășurarea a activității","Admite cererea înregistrată sub nr. 1262 din data de 23.01.2024  având ca obiect: modificare \ndate sediu social; Depunere act constitutiv actualizat (art.204 din Legea nr. 31/1990)  conform actului \nAct constitutiv actualizat din data: 19.01.2024, solicitant declaraţii, înregistrarea datelor din declarația \npe propria răspundere cu privire la îndeplinirea condițiilor de  funcționarea/desfășurarea a activității, \npotrivit datelor din: Declarație pe proprie răspundere cu privire la îndeplinirea condițiilor de \nfuncționare/desfășurare a activității nr. 1262 din 23.01.2024; Decizie asociat unic din 19.01.2024; \ndepunerea actului constitutiv actualizat . \nDispune publicarea prezentei încheieri în Buletinul Electronic al Registrului Comerţului.\n \nDispune publicarea în Monitorul Oficial al României, Partea a IV-a, a următoarelor acte: \nDecizie asociat unic din 19.01.2024 şi a notificării privind depunerea la oficiul registrului comerţului a \nactului constitutiv actualizat. \n \nExecutorie. \n \nCu drept de plângere, în termen de 10 zile, la Tribunalul Tulcea în condițiile art.112 și art.113 \ndin Legea nr. 265/2022 privind registrul comerțului și pentru modificarea și completarea altor acte \nnormative cu incidență asupra înregistrării în registrul comerțului. \n \nPronunțată în data de: 25.01.2024"
1268/23.01.2024,506,26.01.2024,NEOPRO SRL,"Municipiul Tulcea, Strada MIHAI VITEAZU, Nr. 9, camera nr. 1, C1, Etaj P, Judet",Tulcea,17369119,J36/167/2005,ROONRC.J36/167/2005,Geta Voinea,MĂCEŞ  CORNELIU - DĂNUŢ,administrator al  NEOPRO SRL,"înscriere mențiuni ,  referitoare la  Dizolvare si lichidare conform art.227 alin.(1), lit.d si art.235 din Legea nr. 31/1990","Admite cererea înregistrată sub nr. 1268 din data de 23.01.2024  având ca obiect: Dizolvare si \nlichidare conform art.227 alin.(1), lit.d si art.235 din Legea nr. 31/1990, potrivit datelor din: Decizie \nasociat unic din 23.01.2024 . \nDispune publicarea prezentei încheieri în Buletinul Electronic al Registrului Comerţului.\n \nDispune publicarea în Monitorul Oficial al României, Partea a IV-a, a următoarelor acte: \nDecizie asociat unic din 23.01.2024. \n \nExecutorie. \n \nCu drept de plângere, în termen de 10 zile, la Tribunalul Tulcea în condițiile art.112 și art.113 \ndin Legea nr. 265/2022 privind registrul comerțului și pentru modificarea și completarea altor acte \nnormative cu incidență asupra înregistrării în registrul comerțului. \n \nPronunțată în data de: 25.01.2024"
1265/23.01.2024,511,26.01.2024,CHIRAZICĂ MIHAI PESCUIT PERSOANĂ FIZICĂ AUTORIZATĂ,"Sat Grindu, Comuna Grindu, Strada MARGINEA, Nr. 7, Judet Tulcea",Tulcea,29896449,F36/326/2012,ROONRC.F36/326/2012,Geta Voinea,CHIRAZICĂ MIHAI,persoana fizica autorizata  al CHIRAZICĂ MIHAI PESCUIT  PERSOANĂ FIZICĂ AUTORIZATĂ,radierea firmei din registrul comerțului.,"Admite cererea înregistrată sub nr. 1265 din data de 23.01.2024  având ca obiect: \nradiere firmă \nDispune publicarea prezentei încheieri în Buletinul Electronic al Registrului Comerţului. \n \nExecutorie. \n \nCu drept de plângere, în termen de 10 zile, la judecătoria în a cărei rază teritorială se află sediul \nprofesional al solicitantului, în condițiile art.112 și art.113 din Legea nr. 265/2022 privind registrul \ncomerțului și pentru modificarea și completarea altor acte normative cu incidență asupra înregistrării \nîn registrul comerțului. \n \nPronunțată în data de: 25.01.2024"
1284/23.01.2024,505,26.01.2024,DIAPA TRADING S.R.L.,"Municipiul Tulcea, Strada LINIŞTEI, Nr. 8, camera 1, Judet Tulcea",Tulcea,44761372,J36/512/2021,ROONRC.J36/512/2021,Geta Voinea,PANCRAT  ADRIAN,administrator al  DIAPA TRADING S.R.L.,"înscriere mențiuni ,  referitoare la  Dizolvare si lichidare conform art.227 alin.(1), lit.d si art.235 din Legea nr. 31/1990","Admite cererea înregistrată sub nr. 1284 din data de 23.01.2024  având ca obiect: Dizolvare si \nlichidare conform art.227 alin.(1), lit.d si art.235 din Legea nr. 31/1990, potrivit datelor din: Hotărârea \nadunării generale a asociaţilor din 23.01.2024 . \nDispune publicarea prezentei încheieri în Buletinul Electronic al Registrului Comerţului.\n \nDispune publicarea în Monitorul Oficial al României, Partea a IV-a, a următoarelor acte: \nHotărârea adunării generale a asociaţilor din 23.01.2024. \n \nExecutorie. \n \nCu drept de plângere, în termen de 10 zile, la Tribunalul Tulcea în condițiile art.112 și art.113 \ndin Legea nr. 265/2022 privind registrul comerțului și pentru modificarea și completarea altor acte \nnormative cu incidență asupra înregistrării în registrul comerțului. \n \nPronunțată în data de: 25.01.2024"
