dossier_number,decision_number,pronounced_date,firm_name,address,county,registration_code,registration_order,euid,registrator,requestor,quality,request_details,disposition_text
1302,624,31.01.2024,AI VET SERVICES S.R.L.,"Municipiul Tulcea, Strada PRISLAV, Nr. 70, Judet Tulcea",Tulcea,49500610,J36/66/2024,,Geta Voinea,,,,"Admite cererea înregistrată sub numărul 1302 din data de 23.01.2024, autorizează constituirea \na AI VET SERVICES S.R.L., cu următoarele date: \n \n - sediul social: Municipiul Tulcea, Strada PRISLAV, Nr. 70, Judet Tulcea \n- fonduri de comerţ/puncte de lucru: \n1. PUNCT DE LUCRU - Municipiul Tulcea, Strada PĂCII, Nr. 5, Camera 1, Bloc S1, Scara A, Ap. 4, \nJudet Tulcea;  \n - domeniul principal de activitate: grupa CAEN: \n750 - Activităţi veterinare \n - activitate principală: \n7500 - Activităţi veterinare \n - capital social:200 LEI, integral vărsat, total părţi sociale: 200 a câte 1 LEI fiecare \n - fondatori: \n1. BONCOI IOANA-CRISTINA, cu domiciliu în Judet Tulcea, Municipiul Tulcea. \n2. BONCOI ANTAL, cu domiciliu în Judet Tulcea, Municipiul Tulcea. \n - administrator: \n1. BONCOI ANTAL, cu domiciliu în Judet Tulcea, Municipiul Tulcea. \n - durata de funcţionare: nedeterminată;  \n \nDispune înregistrarea în registrul comerțului a datelor din declarația pe propria răspundere cu \nprivire la îndeplinirea condițiilor de  funcționarea/desfășurarea a activității. \nDispune publicarea în Monitorul Oficial al României, Partea a IV-a, a extrasului prezentei \nîncheieri. \nDispune publicarea prezentei încheieri în Buletinul Electronic al Registrului Comerțului. \nExecutorie \n30\n2 \n \nCu drept de plângere, în termen de 10 zile, la Tribunalul Tulcea în condițiile art. 112 și art. 113 \ndin Legea nr. 265/2022 privind registrul comerțului și pentru modificarea și completarea altor acte \nnormative cu incidență asupra înregistrării în registrul comerțului. \nPronunţată în data de: 30.01.2024"
1536/29.01.2024,642,31.01.2024,AGRO TIB SRL,"Sat Colina, Comuna Murighiol, Judet Tulcea",Tulcea,18801095,J36/318/2006,ROONRC.J36/318/2006,Geta Voinea,B.E.J.A.  VLAD IRINEL SI VLAD MARIETA,executor judecătoresc al  AGRO TIB SRL,"înscriere mențiuni , referitoare la  instituire sechestru asupra părților sociale;","Admite cererea înregistrată sub nr. 1536 din data de 29.01.2024  având ca obiect: instituire \nsechestru asupra părților sociale, potrivit datelor din: Proces verbal de sechestru emis de B.E.J.A. \nVLAD IRINEL SI VLAD MARIETA în dosarul nr. 97/2024 din 29.01.2024  . \nDispune publicarea prezentei încheieri în Buletinul Electronic al Registrului Comerţului.  \n \nExecutorie. \n \nCu drept de plângere, în termen de 10 zile, la Tribunalul Tulcea în condițiile art.112 și art.113 \ndin Legea nr. 265/2022 privind registrul comerțului și pentru modificarea și completarea altor acte \nnormative cu incidență asupra înregistrării în registrul comerțului. \n \nPronunțată în data de: 30.01.2024"
1531/29.01.2024,641,31.01.2024,ENODNA SRL,"Sat Colina, Comuna Murighiol, Strada LALELELOR, Nr. 17, Judet Tulcea",Tulcea,29286785,J36/501/2011,ROONRC.J36/501/2011,Geta Voinea,B.E.J.A.  VLAD IRINEL SI VLAD MARIETA,executor judecătoresc al  ENODNA SRL,"înscriere mențiuni , referitoare la  instituire sechestru asupra părților sociale;","Admite cererea înregistrată sub nr. 1531 din data de 29.01.2024  având ca obiect: instituire \nsechestru asupra părților sociale, potrivit datelor din: Proces verbal de sechestru emis de B.E.J.A. \nVLAD IRINEL SI VLAD MARIETA în dosarul nr. 97/2024 din 29.01.2024. \nDispune publicarea prezentei încheieri în Buletinul Electronic al Registrului Comerţului.  \n \nExecutorie. \n \nCu drept de plângere, în termen de 10 zile, la Tribunalul Tulcea în condițiile art.112 și art.113 \ndin Legea nr. 265/2022 privind registrul comerțului și pentru modificarea și completarea altor acte \nnormative cu incidență asupra înregistrării în registrul comerțului. \n \nPronunțată în data de: 30.01.2024"
1325/23.01.2024,621,30.01.2024,PMG SERVICES IMPRODEX S.R.L.,"Municipiul Tulcea, Strada CĂLUGĂRENI, Nr. 40A, camera 1, Judet Tulcea",Tulcea,40796742,J36/216/2019,ROONRC.J36/216/2019,Geta Voinea,PREDA  MIHAIL-GABRIEL,administrator al  PMG SERVICES IMPRODEX S.R.L.,"înscriere mențiuni, referitoare la  schimbarea sediului şi reînmatricularea în Bucureşti Sectorul 1,  Strada MIHAI VITEAZU, Nr. 19, radierea societăţii PMG SERVICES IMPRODEX S.R.L. de la  Oficiul Registrului Comerţului de pe lângă Tribunalul Tulcea; cod obiect de activitate; Depunere act  constitutiv actualizat (art.204 din Legea nr. 31/1990)  conform actului Act constitutiv actualizat din  data: 19.01.2024, modificare date persoane împuternicite; solicitant declaraţii şi înregistrarea datelor  din declarația pe propria răspundere cu privire la îndeplinirea condițiilor de  funcționarea/desfășurarea  a activității","Admite cererea înregistrată sub nr. 1325 din data de 23.01.2024  având ca obiect: schimbarea \nsediului şi reînmatricularea în Bucureşti Sectorul 1, Strada MIHAI VITEAZU, Nr. 19, radierea \nsocietăţii PMG SERVICES IMPRODEX S.R.L. de la Oficiul Registrului Comerţului de pe lângă \nTribunalul Tulcea; cod obiect de activitate; Depunere act constitutiv actualizat (art.204 din Legea nr. \n31/1990)  conform actului Act constitutiv actualizat din data: 19.01.2024, modificare date persoane \nîmputernicite; solicitant declaraţii, înregistrarea datelor din declarația pe propria răspundere cu privire \nla îndeplinirea condițiilor de  funcționarea/desfășurarea a activității, potrivit datelor din: Decizie nr. 1 \ndin 19.01.2024; Declarație pe proprie răspundere cu privire la îndeplinirea condițiilor de \nfuncționare/desfășurare a activității nr. 1325 din 23.01.2024; depunerea actului constitutiv actualizat . \nDispune publicarea prezentei încheieri în Buletinul Electronic al Registrului Comerţului.\n \nDispune publicarea în Monitorul Oficial al României, Partea a IV-a, a următoarelor acte: \nDecizie nr. 1 din 19.01.2024 şi a notificării privind depunerea la oficiul registrului comerţului a actului \nconstitutiv actualizat. \n \nExecutorie. \n \nCu drept de plângere, în termen de 10 zile, la Tribunalul Tulcea în condițiile art.112 și art.113 \ndin Legea nr. 265/2022 privind registrul comerțului și pentru modificarea și completarea altor acte \nnormative cu incidență asupra înregistrării în registrul comerțului. \n \nPronunțată în data de: 30.01.2024"
1266/23.01.2024,622,31.01.2024,AVICOLA CATALOI COOPERATIVA AGRICOLĂ,"Sat Cataloi, Comuna Frecăţei, Strada Principală, Nr. 1, camera 1, Judet Tulcea",Tulcea,40890668,C36/1/2019,ROONRC.C36/1/2019,Geta Voinea,AVRAM  LILIANA-GABRIELA,administrator al  AVICOLA CATALOI COOPERATIVA  AGRICOLĂ,"înscriere mențiuni, referitoare la sedii secundare; solicitant declaraţii şi  înregistrarea datelor din declarația pe propria răspundere cu privire la îndeplinirea condițiilor de   funcționarea/desfășurarea a activității.","Respinge cererea înregistrată sub nr. 1266 din data de 23.01.2024  având ca obiect: sedii \nsecundare; solicitant declaraţii înregistrarea datelor din declarația pe propria răspundere cu privire la \nîndeplinirea condițiilor de  funcționarea/desfășurarea a activității, potrivit datelor din: Declarație pe \nproprie răspundere cu privire la îndeplinirea condițiilor de funcționare/desfășurare a activității nr. 1266 \ndin 23.01.2024. \nDispune publicarea prezentei încheieri în Buletinul Electronic al Registrului Comerţului. \n \nExecutorie. \n \nCu drept de plângere, în termen de 10 zile, la Tribunalul Tulcea în condițiile art.112 și art.113 \ndin Legea nr. 265/2022 privind registrul comerțului și pentru modificarea și completarea altor acte \nnormative cu incidență asupra înregistrării în registrul comerțului. \n \nPronunțată în data de: 30.01.2024"
26371/28.12.2023,58,04.01.2024,ASYSST SOFTDESIGN SRL,"Loc. Babadag, Oraş Babadag, Str. SMÎRDAN, Nr. 9, Judet Tulcea",Tulcea,25477073,J36/192/2009,ROONRC.J36/192/2009,Geta Voinea,IARU  LAURIAN-PAUL,asociat unic al  ASYSST SOFTDESIGN SRL,"înscriere  mențiuni , referitoare la  transmitere părţi sociale pentru persoane fizice; Depunere act constitutiv  actualizat (art.204 din Legea nr. 31/1990)  conform actului Act constitutiv actualizat din data:  27.12.2023, adăugare, retragere asociaţi persoane fizice; modificare date persoane împuternicite","Admite cererea înregistrată sub nr. 26371 din data de 28.12.2023  având ca obiect: transmitere \npărţi sociale pentru persoane fizice; Depunere act constitutiv actualizat (art.204 din Legea nr. 31/1990)  \nconform actului Act constitutiv actualizat din data: 27.12.2023, adăugare, retragere asociaţi persoane \nfizice; modificare date persoane împuternicite, potrivit datelor din: Decizie asociat unic nr. 10 din \n27.12.2023; depunerea actului constitutiv actualizat . \nDispune publicarea prezentei încheieri în Buletinul Electronic al Registrului Comerţului.\n \nDispune publicarea în Monitorul Oficial al României, Partea a IV-a, a următoarelor acte: \nDecizie asociat unic nr. 10 din 27.12.2023 şi a notificării privind depunerea la oficiul registrului \ncomerţului a actului constitutiv actualizat. \n \nExecutorie. \n \nCu drept de plângere, în termen de 10 zile, la Tribunalul Tulcea în condițiile art.112 și art.113 \ndin Legea nr. 265/2022 privind registrul comerțului și pentru modificarea și completarea altor acte \nnormative cu incidență asupra înregistrării în registrul comerțului. \n \nPronunțată în data de: 04.01.2024"
11/03.01.2024,46,04.01.2024,ALISTAR FLORIN APICULTOR PERSOANĂ FIZICĂ AUTORIZATĂ,"Sat Traian, Comuna Cerna, Strada PINILOR, Nr. 13, Judet Tulcea",Tulcea,29727954,F36/148/2012,ROONRC.F36/148/2012,Geta Voinea,ALISTAR  FLORIN,persoana fizica autorizata  al ALISTAR FLORIN APICULTOR PERSOANĂ  FIZICĂ AUTORIZATĂ,radierea firmei din registrul comerțului.,"Admite cererea înregistrată sub nr. 11 din data de 03.01.2024  având ca obiect: \nradiere firmă \nDispune publicarea prezentei încheieri în Buletinul Electronic al Registrului Comerţului. \n \nExecutorie. \n \nCu drept de plângere, în termen de 10 zile, la judecătoria în a cărei rază teritorială se află sediul \nprofesional al solicitantului, în condițiile art.112 și art.113 din Legea nr. 265/2022 privind registrul \ncomerțului și pentru modificarea și completarea altor acte normative cu incidență asupra înregistrării \nîn registrul comerțului. \n \nPronunțată în data de: 04.01.2024"
15/03.01.2024,54,04.01.2024,NAUTIC EXPERTS SRL,"Municipiul Tulcea, Str. BABADAG, Nr. 19, Bloc 11, Scara A, Etaj 2, Ap. 7, Judet Tulcea",Tulcea,5823709,J36/399/1994,ROONRC.J36/399/1994,Geta Voinea,TĂNASE  RAUL-MIHAI,administrator al  NAUTIC EXPERTS SRL,"înscriere mențiuni ,  referitoare la  sedii secundare","Admite cererea înregistrată sub nr. 15 din data de 03.01.2024  având ca obiect: sedii secundare, \npotrivit datelor din: Act adiţional nr. 10 din 21.12.2023 la contractul de închiriere nr. 583 din \n11.12.2019 . \nDispune publicarea prezentei încheieri în Buletinul Electronic al Registrului Comerţului.  \n \nExecutorie. \n \nCu drept de plângere, în termen de 10 zile, la Tribunalul Tulcea în condițiile art.112 și art.113 \ndin Legea nr. 265/2022 privind registrul comerțului și pentru modificarea și completarea altor acte \nnormative cu incidență asupra înregistrării în registrul comerțului. \n \nPronunțată în data de: 04.01.2024"
28/03.01.2024,55,04.01.2024,DA MUV PROD S.R.L.,"Municipiul Tulcea, Aleea MERIŞOR, Nr. 4, parter, Bloc A3, Scara C, Ap. 4, Judet",Tulcea,40826002,J36/160/2020,ROONRC.J36/160/2020,Geta Voinea,PETERMANN EDUARD - BRIAN,asociat unic al  DA MUV PROD S.R.L.,"înscriere mențiuni , referitoare la  Depunere act constitutiv actualizat (art.204 din Legea nr. 31/1990)   conform actului Act constitutiv actualizat  avand numarul 3 din data: 22.12.2023, modificare date  asociaţi persoane fizice; modificare date persoane împuternicite","Admite cererea înregistrată sub nr. 28 din data de 03.01.2024  având ca obiect: Depunere act \nconstitutiv actualizat (art.204 din Legea nr. 31/1990)  conform actului Act constitutiv actualizat  avand \nnumarul 3 din data: 22.12.2023, modificare date asociaţi persoane fizice; modificare date persoane \nîmputernicite, potrivit datelor din: Decizie asociat unic nr. 1 din 22.12.2023; depunerea actului \nconstitutiv actualizat . \nDispune publicarea prezentei încheieri în Buletinul Electronic al Registrului Comerţului.\n \nDispune publicarea în Monitorul Oficial al României, Partea a IV-a, a următoarelor acte: \nDecizie asociat unic nr. 1 din 22.12.2023 şi a notificării privind depunerea la oficiul registrului \ncomerţului a actului constitutiv actualizat. \n \nExecutorie. \n \nCu drept de plângere, în termen de 10 zile, la Tribunalul Tulcea în condițiile art.112 și art.113 \ndin Legea nr. 265/2022 privind registrul comerțului și pentru modificarea și completarea altor acte \nnormative cu incidență asupra înregistrării în registrul comerțului. \n \nPronunțată în data de: 04.01.2024"
56/03.01.2024,41,04.01.2024,CLIOVIT SRL,"Municipiul Tulcea, Str. JUPITER, Nr. 16, Judet Tulcea",Tulcea,17887277,J36/488/2005,ROONRC.J36/488/2005,Geta Voinea,BADEA  GHEORGHE,administrator al  CLIOVIT SRL,radierea firmei din registrul  comerțului,"Admite cererea înregistrată sub nr. 56 din data de 03.01.2024  având ca obiect: radiere firmă  \nMotivul radierii este vointa profesionistului. \nDispune publicarea prezentei încheieri în Buletinul Electronic al Registrului Comerţului.  \n \nExecutorie. \n \nCu drept de plângere, în termen de 10 zile, la Tribunalul Tulcea în condițiile art.112 și art.113 \ndin Legea nr. 265/2022 privind registrul comerțului și pentru modificarea și completarea altor acte \nnormative cu incidență asupra înregistrării în registrul comerțului. \n \nPronunțată în data de: 04.01.2024"
10/03.01.2024,40,04.01.2024,MILAN RESIDENCE S.R.L.,"Municipiul Tulcea, Strada MAHMUDIEI, Nr. 26, Judet Tulcea",Tulcea,29201029,J36/440/2023,ROONRC.J36/440/2023,Geta Voinea,PARASCHIV NICUŞOR,administrator al  MILAN RESIDENCE S.R.L.,"înscriere mențiuni , referitoare la  Dizolvare conform art.235 din Legea nr. 31/1990","Admite cererea înregistrată sub nr. 10 din data de 03.01.2024  având ca obiect: Dizolvare \nconform art.235 din Legea nr. 31/1990, potrivit datelor din: Decizie asociat unic nr. 1 din 14.12.2023 . \nDispune publicarea prezentei încheieri în Buletinul Electronic al Registrului Comerţului.\n \nDispune publicarea în Monitorul Oficial al României, Partea a IV-a, a următoarelor acte: \nDecizie asociat unic nr. 1 din 14.12.2023. \n \nExecutorie. \n \nCu drept de plângere, în termen de 10 zile, la Tribunalul Tulcea în condițiile art.112 și art.113 \ndin Legea nr. 265/2022 privind registrul comerțului și pentru modificarea și completarea altor acte \nnormative cu incidență asupra înregistrării în registrul comerțului. \n \nPronunțată în data de: 04.01.2024"
20,50,04.01.2024,DALCARAN DAN-CRISTIAN PERSOANĂ FIZICĂ AUTORIZATĂ,"Municipiul Tulcea, Strada FRASINULUI, Nr. 12, Bloc 3, Scara B, Etaj 3, Ap. 11, Judet",Tulcea,49359504,F36/3/2024,ROONRC.F36/3/2024,Geta Voinea,,,,"Admite cererea înregistrată sub numărul 20 din data de 03.01.2024, autorizează constituirea a \nDALCARAN DAN-CRISTIAN PERSOANĂ FIZICĂ AUTORIZATĂ, cu următoarele date: \n \n - sediul profesional: Municipiul Tulcea, Strada FRASINULUI, Nr. 12, Bloc 3, Scara B, Etaj 3, Ap. \n11, Judet Tulcea \n - domeniul principal de activitate: grupa CAEN: \n493 - Alte transporturi terestre de călători \n - activitate principală: \n4939 - Alte transporturi terestre de călători n.c.a \n             Persoana fizică autorizată:  \n1. DALCĂRAN DAN-CRISTIAN, cu domiciliu în Judet Tulcea, Municipiul Tulcea. \nDispune înregistrarea în registrul comerțului a datelor din declarația pe propria răspundere cu \nprivire la îndeplinirea condițiilor de  funcționarea/desfășurarea a activității. \nDispune publicarea prezentei încheieri în Buletinul Electronic al Registrului Comerțului. \nExecutorie \nCu drept de plângere, în termen de 10 zile, la judecătoria în a cărei rază teritorială se află sediul \nprofesional al solicitantului, în condițiile art. 112 și art. 113 din Legea nr. 265/2022 privind registrul \ncomerțului și pentru modificarea și completarea altor acte normative cu incidență asupra înregistrării \nîn registrul comerțului. \nPronunţată în data de: 04.01.2024"
26409/28.12.2023,60,04.01.2024,MINI-FARM SRL,"Loc. Babadag, Oraş Babadag, Str. REPUBLICII, Nr. 85, Bloc A1, Scara A, Ap. 1, Judet",Tulcea,8868896,J36/470/1996,ROONRC.J36/470/1996,Geta Voinea,CALIN  VALENTINA,asociat unic al  MINI-FARM SRL,"înscriere mențiuni , referitoare  la  sedii secundare","Admite cererea înregistrată sub nr. 26409 din data de 28.12.2023  având ca obiect: sedii \nsecundare, potrivit datelor din: Contract de subînchiriere nr. 1 din 10.12.2023 . \nDispune publicarea prezentei încheieri în Buletinul Electronic al Registrului Comerţului.  \n \nExecutorie. \n \nCu drept de plângere, în termen de 10 zile, la Tribunalul Tulcea în condițiile art.112 și art.113 \ndin Legea nr. 265/2022 privind registrul comerțului și pentru modificarea și completarea altor acte \nnormative cu incidență asupra înregistrării în registrul comerțului. \n \nPronunțată în data de: 04.01.2024"
8/03.01.2024,45,04.01.2024,MINI-FARM SRL,"Loc. Babadag, Oraş Babadag, Str. REPUBLICII, Nr. 85, Bloc A1, Scara A, Ap. 1, Judet",Tulcea,8868896,J36/470/1996,ROONRC.J36/470/1996,Geta Voinea,CALIN  VALENTINA,asociat unic al  MINI-FARM SRL,"înscriere mențiuni , referitoare  la  sedii secundare","Admite cererea înregistrată sub nr. 8 din data de 03.01.2024  având ca obiect: sedii secundare, \npotrivit datelor din: Decizie asociat unic nr. 7407 din 29.12.2023 . \nDispune publicarea prezentei încheieri în Buletinul Electronic al Registrului Comerţului.  \n \nExecutorie. \n \nCu drept de plângere, în termen de 10 zile, la Tribunalul Tulcea în condițiile art.112 și art.113 \ndin Legea nr. 265/2022 privind registrul comerțului și pentru modificarea și completarea altor acte \nnormative cu incidență asupra înregistrării în registrul comerțului. \n \nPronunțată în data de: 04.01.2024"
32/03.01.2024,56,04.01.2024,GEOTAS AVANTAJ S.R.L.,"Municipiul Tulcea, Strada BUCOVINEI, Nr. 11, Judet Tulcea",Tulcea,37159383,J36/539/2023,ROONRC.J36/539/2023,Geta Voinea,GIGICA  GEORGIANA,administrator al  GEOTAS AVANTAJ S.R.L.,"înscriere mențiuni ,  referitoare la  domeniu principal de activitate/activitate principală; cod obiect de activitate; Depunere  act constitutiv actualizat (art.204 din Legea nr. 31/1990)  conform actului Act constitutiv actualizat   avand numarul 3 din data: 03.01.2024, solicitant declaraţii şi înregistrarea datelor din declarația pe  propria răspundere cu privire la îndeplinirea condițiilor de  funcționarea/desfășurarea a activității","Admite cererea înregistrată sub nr. 32 din data de 03.01.2024  având ca obiect: domeniu \nprincipal de activitate/activitate principală; cod obiect de activitate; Depunere act constitutiv actualizat \n(art.204 din Legea nr. 31/1990)  conform actului Act constitutiv actualizat  avand numarul 3 din data: \n03.01.2024, solicitant declaraţii, înregistrarea datelor din declarația pe propria răspundere cu privire la \nîndeplinirea condițiilor de  funcționarea/desfășurarea a activității, potrivit datelor din: Declarație pe \nproprie răspundere cu privire la îndeplinirea condițiilor de funcționare/desfășurare a activității nr. 32 \ndin 03.01.2024; Decizie asociat unic nr. 2 din 03.01.2024; depunerea actului constitutiv actualizat . \nDispune publicarea prezentei încheieri în Buletinul Electronic al Registrului Comerţului.\n \nDispune publicarea în Monitorul Oficial al României, Partea a IV-a, a următoarelor acte: \nDecizie asociat unic nr. 2 din 03.01.2024 şi a notificării privind depunerea la oficiul registrului \ncomerţului a actului constitutiv actualizat. \n \nExecutorie. \n \nCu drept de plângere, în termen de 10 zile, la Tribunalul Tulcea în condițiile art.112 și art.113 \ndin Legea nr. 265/2022 privind registrul comerțului și pentru modificarea și completarea altor acte \nnormative cu incidență asupra înregistrării în registrul comerțului. \n \nPronunțată în data de: 04.01.2024"
44/03.01.2024,57,04.01.2024,BATRI RIKTRANS S.R.L.,"Municipiul Tulcea, Strada SPITALULUI, Nr. 22, Bloc B3, Scara A, Etaj 4, Ap. 19, Judet",Tulcea,43907926,J36/148/2021,ROONRC.J36/148/2021,Geta Voinea,CĂLIN  VALENTINA,administrator al  BATRI RIKTRANS S.R.L.,"înscriere mențiuni ,  referitoare la  cod obiect de activitate; sedii secundare; Depunere act constitutiv actualizat (art.204 din  Legea nr. 31/1990)  conform actului Act constitutiv actualizat din data: 28.12.2023, numire persoane  împuternicite; solicitant declaraţii şi înregistrarea datelor din declarația pe propria răspundere cu  privire la îndeplinirea condițiilor de  funcționarea/desfășurarea a activității","Admite cererea înregistrată sub nr. 44 din data de 03.01.2024  având ca obiect: cod obiect de \nactivitate; sedii secundare; Depunere act constitutiv actualizat (art.204 din Legea nr. 31/1990)  \nconform actului Act constitutiv actualizat din data: 28.12.2023, numire persoane împuternicite; \nsolicitant declaraţii, înregistrarea datelor din declarația pe propria răspundere cu privire la îndeplinirea \ncondițiilor de  funcționarea/desfășurarea a activității, potrivit datelor din: Declarație pe proprie \nrăspundere cu privire la îndeplinirea condițiilor de funcționare/desfășurare a activității nr. 44 din \n03.01.2024; Hotărârea adunării generale a asociaţilor din 28.12.2023; depunerea actului constitutiv \nactualizat . \nDispune publicarea prezentei încheieri în Buletinul Electronic al Registrului Comerţului.\n \nDispune publicarea în Monitorul Oficial al României, Partea a IV-a, a următoarelor acte: \nHotărârea adunării generale a asociaţilor din 28.12.2023 şi a notificării privind depunerea la oficiul \nregistrului comerţului a actului constitutiv actualizat. \n \nExecutorie. \n \nCu drept de plângere, în termen de 10 zile, la Tribunalul Tulcea în condițiile art.112 și art.113 \ndin Legea nr. 265/2022 privind registrul comerțului și pentru modificarea și completarea altor acte \nnormative cu incidență asupra înregistrării în registrul comerțului. \n \nPronunțată în data de: 04.01.2024"
5/03.01.2024,37,04.01.2024,SISTEM RETAIL S.R.L.,"Municipiul Tulcea, Strada ISACCEI, Nr. 115, biroul 3, Judet Tulcea",Tulcea,49040318,J36/468/2023,ROONRC.J36/468/2023,Geta Voinea,LUCHIAN  ION,administrator al  SISTEM RETAIL S.R.L.,"înscriere mențiuni , referitoare la   sedii secundare; solicitant declaraţii şi înregistrarea datelor din declarația pe propria răspundere cu  privire la îndeplinirea condițiilor de  funcționarea/desfășurarea a activității","Admite cererea înregistrată sub nr. 5 din data de 03.01.2024  având ca obiect: sedii secundare; \nsolicitant declaraţii, înregistrarea datelor din declarația pe propria răspundere cu privire la îndeplinirea \ncondițiilor de  funcționarea/desfășurarea a activității, potrivit datelor din: Declarație pe proprie \nrăspundere cu privire la îndeplinirea condițiilor de funcționare/desfășurare a activității nr. 5 din \n03.01.2024; Hotărâre nr. 8 din 03.01.2024 . \nDispune publicarea prezentei încheieri în Buletinul Electronic al Registrului Comerţului.  \n \nExecutorie. \n \nCu drept de plângere, în termen de 10 zile, la Tribunalul Tulcea în condițiile art.112 și art.113 \ndin Legea nr. 265/2022 privind registrul comerțului și pentru modificarea și completarea altor acte \nnormative cu incidență asupra înregistrării în registrul comerțului. \n \nPronunțată în data de: 04.01.2024"
