dossier_number,decision_number,pronounced_date,firm_name,address,county,registration_code,registration_order,euid,registrator,requestor,quality,request_details,disposition_text
669/15.01.2024,352,19.01.2024,CAFFE DARK BUSINESS S.R.L.,"Municipiul Tulcea, Strada PRIMĂVERII, Nr. 6, camera 2, Judet Tulcea",Tulcea,40881570,J36/251/2019,ROONRC.J36/251/2019,Geta Voinea,COMAN  DANIELA-CĂTĂLINA,administrator al  CAFFE DARK BUSINESS S.R.L.,"înscriere mențiuni , referitoare la  transmitere părţi sociale pentru persoane fizice; cod obiect de  activitate; text obiect de activitate; Depunere act constitutiv actualizat (art.204 din Legea nr. 31/1990)   conform actului Act constitutiv actualizat din data: 12.01.2024, modificare date, adăugare asociaţi  persoane fizice; revocare, numire persoane împuternicite; solicitant declaraţii şi înregistrarea datelor  din declarația pe propria răspundere cu privire la îndeplinirea condițiilor de  funcționarea/desfășurarea  a activității","Admite cererea înregistrată sub nr. 669 din data de 15.01.2024  având ca obiect: transmitere \npărţi sociale pentru persoane fizice; cod obiect de activitate; text obiect de activitate; Depunere act \nconstitutiv actualizat (art.204 din Legea nr. 31/1990)  conform actului Act constitutiv actualizat din \ndata: 12.01.2024, modificare date, adăugare asociaţi persoane fizice; revocare, numire persoane \nîmputernicite; solicitant declaraţii, înregistrarea datelor din declarația pe propria răspundere cu privire \nla îndeplinirea condițiilor de  funcționarea/desfășurarea a activității, potrivit datelor din: Declarație pe \nproprie răspundere cu privire la îndeplinirea condițiilor de funcționare/desfășurare a activității nr. 669 \ndin 15.01.2024; Hotărârea adunării generale a asociaţilor nr. 1 din 12.01.2024; depunerea actului \nconstitutiv actualizat . \nDispune publicarea prezentei încheieri în Buletinul Electronic al Registrului Comerţului.\n \nDispune publicarea în Monitorul Oficial al României, Partea a IV-a, a următoarelor acte: \nHotărârea adunării generale a asociaţilor nr. 1 din 12.01.2024 şi a notificării privind depunerea la \noficiul registrului comerţului a actului constitutiv actualizat. \n \nExecutorie. \n \nCu drept de plângere, în termen de 10 zile, la Tribunalul Tulcea în condițiile art.112 și art.113 \ndin Legea nr. 265/2022 privind registrul comerțului și pentru modificarea și completarea altor acte \nnormative cu incidență asupra înregistrării în registrul comerțului. \n \nPronunțată în data de: 18.01.2024"
829/17.01.2024,361,19.01.2024,MINION SELECT SRL,"Sat Mila 23, Comuna Crişan, Aleea Primăverii, Nr. 2, Judet Tulcea",Tulcea,31226076,J36/61/2013,ROONRC.J36/61/2013,Geta Voinea,B.E.J.  BOGATIE SILVIA LAURA,"executor judecătoresc, pentru  MINION SELECT SRL","înscriere mențiuni , referitoare la  Poprire acţiuni/părţi sociale  conform actului Adresă  avand  numarul 347/2020 din data: 16.01.2024","Admite cererea înregistrată sub nr. 829 din data de 17.01.2024  având ca obiect: Poprire \nacţiuni/părţi sociale , potrivit datelor din: Adresă nr. 347/2020 din 16.01.2024, cu următorul conţinut: \nexecutare silita prin infiintarea unei popriri asupra partilor sociale detinute de debitorul MITITELU \nION . \nDispune publicarea prezentei încheieri în Buletinul Electronic al Registrului Comerţului.  \n \nExecutorie. \n \nCu drept de plângere, în termen de 10 zile, la Tribunalul Tulcea în condițiile art.112 și art.113 \ndin Legea nr. 265/2022 privind registrul comerțului și pentru modificarea și completarea altor acte \nnormative cu incidență asupra înregistrării în registrul comerțului. \n \nPronunțată în data de: 18.01.2024"
825,407,22.01.2024,CARATEO IMPEX S.R.L.,"Sat Ceamurlia de Sus, Comuna Baia, Strada IZVORULUI, Nr. 2, Judet Tulcea",Tulcea,49448148,J36/43/2024,,Geta Voinea,,,,"Admite cererea înregistrată sub numărul 825 din data de 16.01.2024, autorizează constituirea a \nCARATEO IMPEX S.R.L., cu următoarele date: \n \n - sediul social: Sat Ceamurlia de Sus, Comuna Baia, Strada IZVORULUI, Nr. 2, Judet Tulcea \n - domeniul principal de activitate: grupa CAEN: \n461 - Activităţi de intermediere în comerţul cu ridicata \n - activitate principală: \n4618 - Intermedieri în comerţul specializat în vânzarea produselor cu caracter specific, n.c.a. \nText suplimentar: import-export \n - capital social:200 LEI, total părţi sociale: 20 a câte 10 LEI fiecare \n - fondatori: \n1. CARAPIT VASILE, cu domiciliu în Judet Constanţa, Municipiul Constanţa. \n - administrator: \n1. CARAPIT VASILE, cu domiciliu în Judet Constanţa, Municipiul Constanţa. \n - durata de funcţionare: nedeterminată;  \n \nDispune înregistrarea în registrul comerțului a datelor din declarația pe propria răspundere cu \nprivire la îndeplinirea condițiilor de  funcționarea/desfășurarea a activității. \nDispune publicarea în Monitorul Oficial al României, Partea a IV-a, a extrasului prezentei \nîncheieri. \nDispune publicarea prezentei încheieri în Buletinul Electronic al Registrului Comerțului. \nExecutorie \nCu drept de plângere, în termen de 10 zile, la Tribunalul Tulcea în condițiile art. 112 și art. 113 \ndin Legea nr. 265/2022 privind registrul comerțului și pentru modificarea și completarea altor acte \nnormative cu incidență asupra înregistrării în registrul comerțului. \nPronunţată în data de: 19.01.2024"
26459/29.12.2023,26,04.01.2024,ALEXANDRESCU I. CRISTIAN PERSOANĂ FIZICĂ AUTORIZATĂ,"Sat Iazurile, Comuna Valea Nucarilor, Strada SPINULUI, Nr. 2, Judet Tulcea",Tulcea,48210813,F36/216/2023,ROONRC.F36/216/2023,Geta Voinea,ALEXANDRESCU CRISTIAN,persoana fizica autorizata al ALEXANDRESCU I.  CRISTIAN PERSOANĂ FIZICĂ AUTORIZATĂ,"înscriere mențiuni, referitoare la  sedii  secundare; solicitant declaraţii şi înregistrarea datelor din declarația pe propria răspundere cu privire la  îndeplinirea condițiilor de  funcționarea/desfășurarea a activității.","Admite cererea înregistrată sub nr. 26459 din data de 29.12.2023  având ca obiect: sedii \nsecundare; solicitant declaraţii, înregistrarea datelor din declarația pe propria răspundere cu privire la \nîndeplinirea condițiilor de  funcționarea/desfășurarea a activității, potrivit datelor din: Declarație pe \nproprie răspundere cu privire la îndeplinirea condițiilor de funcționare/desfășurare a activității nr. \n26459 din 29.12.2023. \nDispune publicarea prezentei încheieri în Buletinul Electronic al Registrului Comerţului. \n \nExecutorie. \n \nCu drept de plângere, în termen de 10 zile, judecătoria în a cărei rază teritorială se află sediul \nprofesional al solicitantului, în condițiile art.112 și art.113 din Legea nr. 265/2022 privind registrul \ncomerțului și pentru modificarea și completarea altor acte normative cu incidență asupra înregistrării \nîn registrul comerțului. \n \nPronunțată în data de: 03.01.2024"
26207/22.12.2023,3,04.01.2024,PETCU PRESTCOM SRL,"Municipiul Tulcea, Strada MAHMUDIEI, Nr. 159, Judet Tulcea",Tulcea,6852478,J36/87/1994,ROONRC.J36/87/1994,Geta Voinea,PETCU  GHEORGHE,administrator al  PETCU PRESTCOM SRL,"înscriere mențiuni ,  referitoare la  suspendare activitate firma de la 01.01.2024 până la 01.01.2027; solicitant declaraţii şi  înregistrarea datelor din declarația pe propria răspundere cu privire la îndeplinirea condițiilor de   funcționarea/desfășurarea a activității","Admite cererea înregistrată sub nr. 26207 din data de 22.12.2023  având ca obiect: suspendare \nactivitate firma de la 01.01.2024 până la 01.01.2027; solicitant declaraţii, înregistrarea datelor din \ndeclarația pe propria răspundere cu privire la îndeplinirea condițiilor de  funcționarea/desfășurarea a \nactivității, potrivit datelor din: Declarație pe proprie răspundere cu privire la îndeplinirea condițiilor de \nfuncționare/desfășurare a activității nr. 26207 din 22.12.2023; Hotărârea adunării generale a asociaţilor \ndin 20.12.2023 . \nDispune publicarea prezentei încheieri în Buletinul Electronic al Registrului Comerţului.  \n \nExecutorie. \n \nCu drept de plângere, în termen de 10 zile, la Tribunalul Tulcea în condițiile art.112 și art.113 \ndin Legea nr. 265/2022 privind registrul comerțului și pentru modificarea și completarea altor acte \nnormative cu incidență asupra înregistrării în registrul comerțului. \n \nPronunțată în data de: 03.01.2024"
946/18.01.2024,394,22.01.2024,MAHMER SRL,"Municipiul Tulcea, Str. VICTORIEI, Camera nr.1, Bloc 6, Scara B, Etaj 4, Ap. 21, Judet",Tulcea,29160875,J36/463/2011,ROONRC.J36/463/2011,Geta Voinea,MAHMUDI MENDU,administrator al  MAHMER SRL,"înscriere mențiuni ,  referitoare la  sedii secundare","Admite cererea înregistrată sub nr. 946 din data de 18.01.2024  având ca obiect: sedii \nsecundare, potrivit datelor din: Act adiţional nr. 1 din 16.12.2023 la contractul de comodat din \n16.12.2013 . \nDispune publicarea prezentei încheieri în Buletinul Electronic al Registrului Comerţului.  \n \nExecutorie. \n \nCu drept de plângere, în termen de 10 zile, la Tribunalul Tulcea în condițiile art.112 și art.113 \ndin Legea nr. 265/2022 privind registrul comerțului și pentru modificarea și completarea altor acte \nnormative cu incidență asupra înregistrării în registrul comerțului. \n \nPronunțată în data de: 19.01.2024"
953/18.01.2024,392,22.01.2024,URBAN-TULCEA SRL,"Municipiul Tulcea, Str. CHIPAROSULUI, Nr. 4, Bloc 4, Scara B, Ap. 8, Judet Tulcea",Tulcea,5364371,J36/156/1994,ROONRC.J36/156/1994,Geta Voinea,GEANGUŞ  GEORGE-AUREL,administrator al  URBAN-TULCEA SRL,"înscriere mențiuni ,  referitoare la  sedii secundare; solicitant declaraţii şi înregistrarea datelor din declarația pe propria  răspundere cu privire la îndeplinirea condițiilor de  funcționarea/desfășurarea a activității","Admite cererea înregistrată sub nr. 953 din data de 18.01.2024  având ca obiect: sedii \nsecundare; solicitant declaraţii, înregistrarea datelor din declarația pe propria răspundere cu privire la \nîndeplinirea condițiilor de  funcționarea/desfășurarea a activității, potrivit datelor din: Declarație pe \nproprie răspundere cu privire la îndeplinirea condițiilor de funcționare/desfășurare a activității nr. 953 \ndin 18.01.2024; Decizie nr. 1 din 18.01.2024 . \nDispune publicarea prezentei încheieri în Buletinul Electronic al Registrului Comerţului.  \n \nExecutorie. \n \nCu drept de plângere, în termen de 10 zile, la Tribunalul Tulcea în condițiile art.112 și art.113 \ndin Legea nr. 265/2022 privind registrul comerțului și pentru modificarea și completarea altor acte \nnormative cu incidență asupra înregistrării în registrul comerțului. \n \nPronunțată în data de: 19.01.2024"
707/15.01.2024,399,22.01.2024,IZABELA STYLE BEAUTY S.R.L.,"Sat Beştepe, Comuna Beştepe, Strada Codrului, Nr. 15, Judet Tulcea",Tulcea,49378638,J36/9/2024,ROONRC.J36/9/2024,Geta Voinea,POPA  MARIA,administrator al  IZABELA STYLE BEAUTY S.R.L.,"înscriere mențiuni  , referitoare la  sedii secundare; solicitant declaraţii şi înregistrarea datelor din declarația pe propria  răspundere cu privire la îndeplinirea condițiilor de  funcționarea/desfășurarea a activității","Admite cererea înregistrată sub nr. 707 din data de 15.01.2024  având ca obiect: sedii \nsecundare; solicitant declaraţii, înregistrarea datelor din declarația pe propria răspundere cu privire la \nîndeplinirea condițiilor de  funcționarea/desfășurarea a activității, potrivit datelor din: Declarație pe \nproprie răspundere cu privire la îndeplinirea condițiilor de funcționare/desfășurare a activității nr. 707 \ndin 15.01.2024; Decizie asociat unic nr. 2 din 12.01.2024 . \nDispune publicarea prezentei încheieri în Buletinul Electronic al Registrului Comerţului.  \n \nExecutorie. \n \nCu drept de plângere, în termen de 10 zile, la Tribunalul Tulcea în condițiile art.112 și art.113 \ndin Legea nr. 265/2022 privind registrul comerțului și pentru modificarea și completarea altor acte \nnormative cu incidență asupra înregistrării în registrul comerțului. \n \nPronunțată în data de: 19.01.2024"
629/15.01.2024,381,22.01.2024,BUHIMEX SRL,"Sat Mila 23, Comuna Crişan, Strada NUFĂRULUI, Nr. 112, Judet Tulcea",Tulcea,2375473,J36/723/1992,ROONRC.J36/723/1992,Geta Voinea,BUHAEV  S.VARVARA,administrator al  BUHIMEX SRL,radierea firmei din registrul  comerțului.,"Respinge cererea înregistrată sub nr. 629 din data de 15.01.2024  având ca obiect: radiere \nfirmă. \nDispune publicarea prezentei încheieri în Buletinul Electronic al Registrului Comerţului. \n \nExecutorie. \n \nCu drept de plângere, în termen de 10 zile, la Tribunalul Tulcea în condițiile art.112 și art.113 \ndin Legea nr. 265/2022 privind registrul comerțului și pentru modificarea și completarea altor acte \nnormative cu incidență asupra înregistrării în registrul comerțului. \n \nPronunțată în data de: 19.01.2024"
928/18.01.2024,393,22.01.2024,VLĂDUŢ-NARCIS SRL,"Municipiul Tulcea, Str. CONSTRUCTORILOR, DALE CANAL, Lotul 29, Judet Tulcea",Tulcea,14674975,J36/156/2002,ROONRC.J36/156/2002,Geta Voinea,OLARU  TANŢA,administrator al  VLĂDUŢ-NARCIS SRL,radierea firmei din registrul  comerțului,"Admite cererea înregistrată sub nr. 928 din data de 18.01.2024  având ca obiect: radiere firmă  \nMotivul radierii este art.235 din Legea nr.31/1990. \nDispune publicarea prezentei încheieri în Buletinul Electronic al Registrului Comerţului.  \n \nExecutorie. \n \nCu drept de plângere, în termen de 10 zile, la Tribunalul Tulcea în condițiile art.112 și art.113 \ndin Legea nr. 265/2022 privind registrul comerțului și pentru modificarea și completarea altor acte \nnormative cu incidență asupra înregistrării în registrul comerțului. \n \nPronunțată în data de: 19.01.2024"
936/18.01.2024,379,22.01.2024,ANASTASE SILVIU PERSOANĂ FIZICĂ AUTORIZATĂ,"Sat Sabangia, Comuna Sarichioi, Nr. 89A, Judet Tulcea",Tulcea,37065130,F36/125/2017,ROONRC.F36/125/2017,Geta Voinea,ANASTASE SILVIU,persoana fizica autorizata  al ANASTASE SILVIU PERSOANĂ  FIZICĂ AUTORIZATĂ,radierea firmei din registrul comerțului.,"Admite cererea înregistrată sub nr. 936 din data de 18.01.2024  având ca obiect: \nradiere firmă \nDispune publicarea prezentei încheieri în Buletinul Electronic al Registrului Comerţului. \n \nExecutorie. \n \nCu drept de plângere, în termen de 10 zile, la judecătoria în a cărei rază teritorială se află sediul \nprofesional al solicitantului, în condițiile art.112 și art.113 din Legea nr. 265/2022 privind registrul \ncomerțului și pentru modificarea și completarea altor acte normative cu incidență asupra înregistrării \nîn registrul comerțului. \n \nPronunțată în data de: 19.01.2024"
954/18.01.2024,388,22.01.2024,DORMIH TIM SRL,"Municipiul Tulcea, Strada 1848, Nr. 5, camera nr.3, Bloc 4, Scara B, Ap. 22, Judet",Tulcea,31565439,J36/165/2013,ROONRC.J36/165/2013,Geta Voinea,MAXIM  NICOLETA,administrator al  DORMIH TIM SRL,"înscriere mențiuni , referitoare  la  sedii secundare","Admite cererea înregistrată sub nr. 954 din data de 18.01.2024  având ca obiect: sedii \nsecundare, potrivit datelor din: Act adiţional nr. 2 din 18.05.2021 la contractul de închiriere \nnr.332/04.05.2017 , Act adiţional nr. 1 din 31.12.2019 la contractul de închiriere nr.332/04.05.2017. \nDispune publicarea prezentei încheieri în Buletinul Electronic al Registrului Comerţului.  \n \nExecutorie. \n \nCu drept de plângere, în termen de 10 zile, la Tribunalul Tulcea în condițiile art.112 și art.113 \ndin Legea nr. 265/2022 privind registrul comerțului și pentru modificarea și completarea altor acte \nnormative cu incidență asupra înregistrării în registrul comerțului. \n \nPronunțată în data de: 19.01.2024"
743/16.01.2024,380,22.01.2024,STEEL MARCONSTRUCT SRL,"Municipiul Tulcea, Strada ING. DUMITRU IVANOV, Nr. 6, parter, camera 6, clădirea",Tulcea,36198490,J36/271/2016,ROONRC.J36/271/2016,Geta Voinea,SELA  GEORGIAN,administrator al  STEEL MARCONSTRUCT SRL,"înscriere  mențiuni , referitoare la  sedii secundare; solicitant declaraţii şi înregistrarea datelor din declarația pe  propria răspundere cu privire la îndeplinirea condițiilor de  funcționarea/desfășurarea a activității","Admite cererea înregistrată sub nr. 743 din data de 16.01.2024  având ca obiect: sedii \nsecundare; solicitant declaraţii, înregistrarea datelor din declarația pe propria răspundere cu privire la \nîndeplinirea condițiilor de  funcționarea/desfășurarea a activității, potrivit datelor din: Decizie asociat \nunic nr. 76 din 16.01.2024; Declarație pe proprie răspundere cu privire la îndeplinirea condițiilor de \nfuncționare/desfășurare a activității nr. 743 din 16.01.2024 . \nDispune publicarea prezentei încheieri în Buletinul Electronic al Registrului Comerţului.  \n \nExecutorie. \n \nCu drept de plângere, în termen de 10 zile, la Tribunalul Tulcea în condițiile art.112 și art.113 \ndin Legea nr. 265/2022 privind registrul comerțului și pentru modificarea și completarea altor acte \nnormative cu incidență asupra înregistrării în registrul comerțului. \n \nPronunțată în data de: 19.01.2024"
932/18.01.2024,376,22.01.2024,VISTA PIC ANETO SRL,"Sat Mahmudia, Comuna Mahmudia, Strada SALSOVIA, Nr. 88, camera 1, Judet Tulcea",Tulcea,31898000,J36/251/2013,ROONRC.J36/251/2013,Geta Voinea,PANCRATOV LILIANA,administrator al  VISTA PIC ANETO SRL,"înscriere  mențiuni , referitoare la  modificare stare firmă; Dizolvare si lichidare conform art.227 alin.(1), lit.d si  art.235 din Legea nr. 31/1990","Admite cererea înregistrată sub nr. 932 din data de 18.01.2024  având ca obiect: modificare \nstare firmă; Dizolvare si lichidare conform art.227 alin.(1), lit.d si art.235 din Legea nr. 31/1990, \npotrivit datelor din: Decizie asociat unic nr. 1 din 18.01.2024 . \nDispune publicarea prezentei încheieri în Buletinul Electronic al Registrului Comerţului.\n \nDispune publicarea în Monitorul Oficial al României, Partea a IV-a, a următoarelor acte: \nDecizie asociat unic nr. 1 din 18.01.2024. \n \nExecutorie. \n \nCu drept de plângere, în termen de 10 zile, la Tribunalul Tulcea în condițiile art.112 și art.113 \ndin Legea nr. 265/2022 privind registrul comerțului și pentru modificarea și completarea altor acte \nnormative cu incidență asupra înregistrării în registrul comerțului. \n \nPronunțată în data de: 19.01.2024"
988/18.01.2024,389,22.01.2024,ALDION SRL,"Loc. Măcin, Oraş Măcin, Str. VINATORI, Nr. 91, Judet Tulcea",Tulcea,7445804,J36/312/1995,ROONRC.J36/312/1995,Geta Voinea,ALDEA  IONEL,administrator al  ALDION SRL,"înscriere mențiuni , referitoare la   domeniu principal de activitate/activitate principală; text domeniu principal de activitate/activitate  principală; cod obiect de activitate; text obiect de activitate; sedii secundare; Depunere act constitutiv  actualizat (art.204 din Legea nr. 31/1990)  conform actului Act constitutiv actualizat din data:  18.01.2024, modificare date persoane împuternicite; durată societate; solicitant declaraţii şi  înregistrarea datelor din declarația pe propria răspundere cu privire la îndeplinirea condițiilor de   funcționarea/desfășurarea a activității","Admite cererea înregistrată sub nr. 988 din data de 18.01.2024  având ca obiect: domeniu \nprincipal de activitate/activitate principală; text domeniu principal de activitate/activitate principală; \ncod obiect de activitate; text obiect de activitate; sedii secundare; Depunere act constitutiv actualizat \n(art.204 din Legea nr. 31/1990)  conform actului Act constitutiv actualizat din data: 18.01.2024, \nmodificare date persoane împuternicite; durată societate; solicitant declaraţii, înregistrarea datelor din \ndeclarația pe propria răspundere cu privire la îndeplinirea condițiilor de  funcționarea/desfășurarea a \nactivității, potrivit datelor din: Declarație pe proprie răspundere cu privire la îndeplinirea condițiilor de \nfuncționare/desfășurare a activității nr. 988 din 18.01.2024; Decizie asociat unic din 18.01.2024; \ndepunerea actului constitutiv actualizat . \nDispune publicarea prezentei încheieri în Buletinul Electronic al Registrului Comerţului.\n \nDispune publicarea în Monitorul Oficial al României, Partea a IV-a, a următoarelor acte: \nDecizie asociat unic din 18.01.2024 şi a notificării privind depunerea la oficiul registrului comerţului a \nactului constitutiv actualizat. \n \nExecutorie. \n \nCu drept de plângere, în termen de 10 zile, la Tribunalul Tulcea în condițiile art.112 și art.113 \ndin Legea nr. 265/2022 privind registrul comerțului și pentru modificarea și completarea altor acte \nnormative cu incidență asupra înregistrării în registrul comerțului. \n \nPronunțată în data de: 19.01.2024"
944/18.01.2024,395,22.01.2024,TRIŞCĂ BOGDAN-VALENTIN ÎNTREPRINDERE INDIVIDUALĂ,"Sat Crişan, Comuna Crişan, Judet Tulcea",Tulcea,27119942,F36/377/2010,ROONRC.F36/377/2010,Geta Voinea,TRIŞCĂ  BOGDAN - VALENTIN,titular întreprindere individuala  al TRIŞCĂ BOGDAN- VALENTIN ÎNTREPRINDERE INDIVIDUALĂ,radierea firmei din registrul comerțului.,"Admite cererea înregistrată sub nr. 944 din data de 18.01.2024  având ca obiect: \nmodificare stare firmă; radiere firmă \nDispune publicarea prezentei încheieri în Buletinul Electronic al Registrului Comerţului. \n \nExecutorie. \n \nCu drept de plângere, în termen de 10 zile, la judecătoria în a cărei rază teritorială se află sediul \nprofesional al solicitantului, în condițiile art.112 și art.113 din Legea nr. 265/2022 privind registrul \ncomerțului și pentru modificarea și completarea altor acte normative cu incidență asupra înregistrării \nîn registrul comerțului. \n \nPronunțată în data de: 19.01.2024"
971/18.01.2024,387,22.01.2024,AGROMEC MAHMUDIA SA,"Sat Mahmudia, Comuna Mahmudia, Com. MAHMUDIA, Judet Tulcea",Tulcea,2375775,J36/412/1991,ROONRC.J36/412/1991,Geta Voinea,MIHALACHE ION,administrator al  AGROMEC MAHMUDIA SA,"înscriere  mențiuni , referitoare la  cod obiect de activitate; Depunere act constitutiv actualizat (art.204 din Legea  nr. 31/1990)  conform actului Act constitutiv actualizat din data: 18.01.2024, solicitant declaraţii şi  înregistrarea datelor din declarația pe propria răspundere cu privire la îndeplinirea condițiilor de   funcționarea/desfășurarea a activității","Admite cererea înregistrată sub nr. 971 din data de 18.01.2024  având ca obiect: cod obiect de \nactivitate; Depunere act constitutiv actualizat (art.204 din Legea nr. 31/1990)  conform actului Act \nconstitutiv actualizat din data: 18.01.2024, solicitant declaraţii, înregistrarea datelor din declarația pe \npropria răspundere cu privire la îndeplinirea condițiilor de  funcționarea/desfășurarea a activității, \npotrivit datelor din: Hotărârea adunării generale extraordinare a acţionarilor nr. 1 din 18.01.2024; \nDeclarație pe proprie răspundere cu privire la îndeplinirea condițiilor de funcționare/desfășurare a \nactivității nr. 971 din 18.01.2024; depunerea actului constitutiv actualizat . \nDispune publicarea prezentei încheieri în Buletinul Electronic al Registrului Comerţului.\n \nDispune publicarea în Monitorul Oficial al României, Partea a IV-a, a următoarelor acte: \nHotărârea adunării generale extraordinare a acţionarilor nr. 1 din 18.01.2024 şi a notificării privind \ndepunerea la oficiul registrului comerţului a actului constitutiv actualizat. \n \nExecutorie. \n \nCu drept de plângere, în termen de 10 zile, la Tribunalul Tulcea în condițiile art.112 și art.113 \ndin Legea nr. 265/2022 privind registrul comerțului și pentru modificarea și completarea altor acte \nnormative cu incidență asupra înregistrării în registrul comerțului. \n \nPronunțată în data de: 19.01.2024"
